over_number,commentary_data,timestamp,match_id
15.3," Lalit Yadav to Anuj Rawat, no run, flat on off, Rawat with a shimmy pulls but straight towards mid-wicket ",1681557531722,66260
15.4," Lalit Yadav to Anuj Rawat, 1 run, flat and coming in, Rawat gets low to pull to the left of mid-wicket for a single.  ",1681557553298,66260
15.4," Lalit Yadav to Anuj Rawat, 1 run, flat and coming in, Rawat gets low to pull to the left of mid-wicket for a single.  ",1681557553298,66260
15.5," Lalit Yadav to Shahbaz Ahmed, , fuller but slides down leg. A half-hearted appeal for caught behind but called wide ",1681557581758,66260
15.5," Lalit Yadav to Shahbaz Ahmed, 1 run, flat and coming in, backfoot punched towards mid-wicket ",1681557610077,66260
15.6," Lalit Yadav to Anuj Rawat, 1 run, juicy full toss, was there to be hit but Anuj Rawat gently turns towards deep mid-wicket for a single ",1681557634465,66260
15.6,"Slightly puzzling tactics from RCB, sending Anuj Rawat as an impact sub ahead of Hasaranga. They are playing into the hands of DC who can easily switch to off-spin. And Rawat has only been blocking...",1681557637465,66260
16.1," Kuldeep Yadav to Anuj Rawat, no run, flat just outside off, dabbed towards backward point ",1681557694930,66260
16.2," Kuldeep Yadav to Anuj Rawat, no run, quicker on off, Rawat gets back to push to backward point for a quick run but Shahbaz refuses ",1681557716329,66260
16.3," Kuldeep Yadav to Anuj Rawat, 1 run, short on off, cut square of the wicket for a single this time ",1681557741519,66260
16.4," Kuldeep Yadav to Shahbaz Ahmed, 1 run, flighted up and a bit wider, pushed towards covers gently for a single ",1681557770865,66260
16.5," Kuldeep Yadav to Anuj Rawat, 1 run, flat delivery, punched down to long-on ",1681557792910,66260
16.5, This collapse can be an example to people who don't understand the importance of an anchor role,1681557792911,66260
16.6," Kuldeep Yadav to Shahbaz Ahmed, , boundary after long!! This was tossed up, Shahbaz Ahmed shuffles in to take as a low full toss and sweeps it nicely behind square for four... ",1681557816197,66260
16.6,,1681557864439,66260
17.1," Nortje to Anuj Rawat, 1 run, full and straight, Anuj Rawat dances out but gets a tame drive to mid-off for a single ",1681557910384,66260
17.2," Nortje to Shahbaz Ahmed, leg byes, 1 run, on a length and skids onto the pads, deflects past the keeper to fine leg ",1681557950066,66260
17.3," Nortje to Anuj Rawat, no run, good length and angling in from round the wicket, lobs off the pads towards the keeper as Rawat misses the flick ",1681557976616,66260
17.4," Nortje to Anuj Rawat, 2 runs, steaming in onto the pads, fended away behind square on the leg side for a couple of runs. ",1681558039902,66260
17.5," Nortje to Anuj Rawat, no run, nice surprise bouncer, left alone by Rawat thinking it will be too high. But the umpires are happy... ",1681558058746,66260
17.6," Nortje to Anuj Rawat, , much needed, he really needed that shot!! This was a cutter onto middle, Rawat danced out and whacked it over mid-wicket into the big gap for a boundary ",1681558089146,66260
17.6,,1681558155934,66260
18.1," Mustafizur to Shahbaz Ahmed, , low full toss outside off, Shahbaz Ahmed shuffles in and drives in to the left of extra cover. Between the two deep fielders and four... ",1681558193129,66260
18.1," Mustafizur to Shahbaz Ahmed, , low full toss outside off, Shahbaz Ahmed shuffles in and drives in to the left of extra cover. Between the two deep fielders and four... ",1681558193129,66260
18.1,Extra cover moves to mid-off. Long-off goes very wide,1681558196129,66260
18.2," Mustafizur to Shahbaz Ahmed, 1 run, low full toss at the stumps, driven straight and long-on blocks it out ",1681558240196,66260
18.3," Mustafizur to Anuj Rawat, 1 run, another low full toss, driven to long-on ",1681558276560,66260
18.3, Really don't understand the tactics from RCB by not sending Hasaranga and use out the impact sub when we know how much Karn Sharma could have impacted the game.,1681558276561,66260
18.3,Rahman round the wicket now,1681558279560,66260
18.4," Mustafizur to Shahbaz Ahmed, , once again a low full toss, this was at the stumps and Shahbaz Ahmed shuffles in to sweep it through a vacant square leg for a boundary... ",1681558327192,66260
18.4,"Rahman back over the wicket. backward point inside the cirlce, square leg goes back",1681558330192,66260
18.5," Mustafizur to Shahbaz Ahmed, 1 run, blockhole delivery, heaved towards deep mid-wicket ",1681558383692,66260
18.6," Mustafizur to Anuj Rawat, 1 run, nice yorker outside off, Rawat digs it into the pitch and towards long-on ",1681558417515,66260
19.1," Nortje to Anuj Rawat, 1 run, blockhole delivery, pushed towards long-on ",1681558508273,66260
19.2," Nortje to Shahbaz Ahmed, 1 run, slower length ball, slammed into the pitch and towards long-on again ",1681558537127,66260
19.3," Nortje to Anuj Rawat, leg byes, 1 run, lovely yorker from round the wicket, I0$Off the boots to the leg side for a leg bye ",1681558578157,66260
19.4," Nortje to Shahbaz Ahmed, byes, 1 run, superb execution of the yorker again, goes between Shahbaz's legs and the keeper with a slight fumble to allow the RCB players to sneak across ",1681558628487,66260
19.5," Nortje to Anuj Rawat, 1 run, low full toss on the pads, turned towards fine leg.  ",1681558663663,66260
19.6," Nortje to Shahbaz Ahmed, , full and chasing Shahbaz as he backed away. Goes too wide on leg side ",1681558700414,66260
19.6," Nortje to Shahbaz Ahmed, 2 runs, full on middle and leg, Shahbaz inside halves his heave towards deep square leg. A fumble first there and there not a clean pick-up by Porel allows RCB to end their innings with two runs. ",1681558743103,66260
19.6," An innings of two halves!! RCB were 89/1 after 10 overs and looking good for another score in excess of 200. Virat Kohli teed off in the powerplay once again, and Faf played a few big shots too before a stunning take by Aman Khan at mid-wicket sent him back. Kohli and new man Lomror attacked Mustafizur, smashing 19 off his second over. The former RCB skipper got another fifty, but then holed out to a juicy full toss. Glenn Maxwell came out and went hell for leather against the spinners, got he was deceived into a false shot by Kuldeep. Then began a brain fade for RCB, as they lost three wickets in three balls across two overs, with DK getting another duck. A few puzzling stratergy calls as well, sending Harshal Patel up at 5 and using Anuj Rawat as an impact player - who stopped Hasaranga and Parnell from entering the game. In the end, DC would be very happy with the way they fought back in this game, but their batting unit has blown hot and cold this season. It could be an interesting chase, stick around...",1681558746103,66260
19.6,,1681558746113,66260
19.6," The wicket was on the slower side, so I tried to hit the right areas and right lengths. I threw a few wide balls against Virat bhai. He (Maxwell) was going really well, I believed in myself, so I got him out, and next ball even got DK (Karthik) out, pulled the game back in our favour. Just trying to bowl in the right areas, if you do that, you'll get wickets. 175 is a good total as the pitch is on the slower side. Need to keep rotating the strike, especially against the spinners.",1681558746123,66260
19.6,"We're back for the chase..  and he's come on straightaway, Warner is the other man in, he's had runs, but his SR has been under question. 175 isn't a huge target, but DC will need a good start.. Siraj with the new ball for RCB, one slip in place",1681559333643,66260
19.6," This was the worst use of an Impact Player. They should have sent in Hasaranga and Parnell and if they too had failed, then it would have made sense to bring in Anuj Rawat. Now they can't even bring in an additional spinner as they have used up the impact",1681559333644,66260
19.6,,1681559740064,66260
19.6,,1681559740064,66260
0.1," Siraj to Warner, no run, good start from Siraj, hint of shape back into the left-hander, Warner is cramped for room as he stabs it to the off-side ",1681559743028,66260
0.2," Siraj to Warner, 1 run, short of a good length and at the stumps, Warner crouches across and pulls it past square leg, he was always coming back for the second and is slightly annoyed as Prithvi Shaw turns it down ",1681559780819,66260
0.3," Siraj to Prithvi Shaw, no run, Siraj shortens the length around off, Shaw prods across and turns it to the on-side ",1681559820186,66260
0.3," Siraj to Prithvi Shaw,  Run Out!! ",1681559905950,66260
0.4,"Siraj to Prithvi Shaw,  Prithvi Shaw Run Out!! A direct hit from RCB's impact player and Shaw is OUT. That's a sensational bit of fielding from the man who just made all the wrong headlines,. On a good length and just outside off - Shaw stays on the back-foot and pushes it to the right of cover, the single was always on, but Rawat skipped across to his right, dived and made a one-handed stop, gets up and then throws down the stumps at the bowler's end, catching Shaw well short of his crease. Everything happened in omne motion and Shaw had no chance. ",1681559907802,66260
0.4,,1681559955683,66260
0.5," Siraj to Warner, no run, short of a good length and just outside off, nudged off the back-foot to mid-wicket ",1681559960088,66260
0.6," Siraj to Warner, no run, banged in short by Siraj - Warner drops his wrists and watches it sail through to the keeper ",1681559992639,66260
0.6,,1681560042269,66260
1.1," Parnell to Mitchell Marsh, no run, on a good length and slanting across the right-hander, Marsh covers the line, lifts his bat and lets it go ",1681560086433,66260
1.1,A slip in place for Marsh,1681560089433,66260
1.1,A slip in place for Marsh,1681560089433,66260
1.2," Parnell to Mitchell Marsh, no run, Parnell shortens the length and angles one across the right-hander - Marsh is in two minds and makes a late call to let it go by ",1681560120464,66260
1.3," Parnell to Mitchell Marsh, no run, on a good length and just outside off, Marsh prods across and defends it to the off-side ",1681560156068,66260
1.3, Finally RCB's Impact player has done something,1681560156069,66260
1.3," Parnell to Mitchell Marsh,  Caught!! ",1681560205065,66260
1.4,"Parnell to Mitchell Marsh,  Caught by Kohli!! A massive leading edge and RCB have two - short of a good length and angling inbto the right-hander, Marsh was shaping across on the flick, closed the bat-face early and gets a massive top-edge, high and down towards cover-point - Kohli is the man under it, he watches it all along and takes it with glee. Perfect start from RCB, getting back all the lost momentum from the back-end of their batting effort. ",1681560207909,66260
1.4,,1681560298892,66260
1.5," Parnell to Yash Dhull, no run, fuller length delivery outside off , Dhull leans into the drive and finds mid-off ",1681560301552,66260
1.6," Parnell to Yash Dhull, 1 run, back of a length and angling across the right-hander, punched to the right of cover for a single - 2 overs, 2 runs and 2 wickets so far ",1681560338521,66260
2.1," Siraj to Yash Dhull, no run, shout for LBW, but it did look high to the naked eye, Faf says the same and , there was an inside edge as well - the nip-backer and Dhull was caught in the crease as he looked to work it to the on-side ",1681560424352,66260
2.1,"This is plumb, this is absolutely plumb, , did he get an inside edge? Only that can save him here - the bat is close to the inside edge, did it graze it on its way to the back pad? UltraEdge shows a flat line and it's three reds on ball-tracking.",1681560430352,66260
2.1," Siraj to Yash Dhull,  Lbw!! ",1681560539928,66260
2.2,"Siraj to Yash Dhull,  Lbw!! This is plumb, this is absolutely plumb, , did he get an inside edge? Only that can save him here - the bat is close to the inside edge, did it graze it on its way to the back pad? UltraEdge shows a flat line and . This is disaster for the Capitals, they're 2 for 3 now - the nip-backer from Siraj and Dhull was once again caught in the crease, to make it worse, he tried to play around the front-pad, was a dead duck once he missed and it's an easy call for the umpire. ",1681560543176,66260
2.2,,1681560624507,66260
2.3," Siraj to Manish Pandey, no run, Manish is cut in half now - Siraj is making this new ball talk, niped back from a length and burst past Manish's inside edge, only the bounce saving the right-hander as it zipped through to Karthik ",1681560641011,66260
2.4," Siraj to Manish Pandey, no run, short of a good length and just outside off - Manish is half-forward as he pushes it back at the bowler ",1681560670122,66260
2.5," Siraj to Manish Pandey, no run, banged in short and at the right-hander - Pandey drops his wrists and sways away from the line ",1681560715851,66260
2.6," Siraj to Manish Pandey, 2 runs, short of a good length and at the stumps, a cramped Manish manages to get the pull away behind square on the on-side, comes back for the second ",1681560766569,66260
3.1," Parnell to Warner, 1 run, fuller length delivery on off, Warner looks to drive and drags a thick inside edge past square leg for a single ",1681560841756,66260
3.2," Parnell to Manish Pandey, no run, another leading edge, but Manish is lucky that the lobe didn't go into Kolhli's hands at cover-point - reared on from a length and caught the shoulder of the bat as he looked to defend ",1681560884700,66260
3.3," Parnell to Manish Pandey, 1 run, short of a good length and at the stumps, nudged past square leg for a single ",1681560916907,66260
3.3," Parnell to Manish Pandey, 1 run, short of a good length and at the stumps, nudged past square leg for a single ",1681560916907,66260
3.4," Parnell to Warner, 1 run, back of a length and angling into the left-hander, chopped away square on the off-side for a single ",1681560956967,66260
3.5," Parnell to Manish Pandey, , , that should get Manish going - comes down the pitch, doesn't get too close and that allows a free-flow of the bat, drills it wide of mid-off for a boundary ",1681560989411,66260
3.6," Parnell to Manish Pandey, 1 run, short of a good length and just outside off, Manish stays besides the line and pushes it to the right of backward point for a single ",1681561027317,66260
4.1," Siraj to Manish Pandey, no run, Siraj shortens the length outside off - Manish rides the bounce and pushes it to the off-side ",1681561120120,66260
4.1,,1681561120130,66260
4.2," Siraj to Manish Pandey, 1 run, on a good length and just outside off, Manish lets the ball come and then dabs it behind point for a single ",1681561146343,66260
4.3," Siraj to Warner, no run, fraction fuller and angling across the left-hander - Warner stays leg-sided and then drops it to the off-side ",1681561189288,66260
4.3, Huge responsibility on Warner and Pandey to change it from football to cricket match.,1681561189289,66260
4.3, Siraj is unstoppable at powerplay.,1681561189394,66260
4.4," Siraj to Warner, , , too short from Siraj, sat up to be smacked - Warner swivels across and then hammers the pull over mid-wicket, couple of bounces and over the ropes ",1681561232282,66260
4.5," Siraj to Warner, , back-to-back boundaries for Warner - is this the release they needed? Short and down leg, he swivels across, lets the ball come and then rolls his wrists over the fine pull, runs away to the ropes in a hurry ",1681561272466,66260
4.6," Siraj to Warner, , , this is the best of the lot - on a good length and angling across the left-hander, Warner stays on the back-foot, doesn't go too hard on the drive and then finds the gap wide of cover, no need to run for those ",1681561312096,66260
4.6,"Vyshak on debut in front of his home crowd, he's bowling to his Karnataka mate",1681561315096,66260
4.6,,1681561393309,66260
5.1," Vijaykumar Vyshak to Manish Pandey, 1 run, back of a length and angling across the right-hander, Manish walks down the pitch and runs it behind square on the off-side for a single ",1681561405921,66260
5.2," Vijaykumar Vyshak to Warner, no run, short of a length anbd angling across the left-hander, Warner was shaping for the big pull and is undone by the away going angle ",1681561449983,66260
5.3," Vijaykumar Vyshak to Warner, , , Warner is looking in good touch today, back of a length and at the hips, he swivels across and then brings his wrists into play, used the pace and found the gap behind square on the on-side ",1681561490149,66260
5.3," Vijaykumar Vyshak to Warner,  Caught!! ",1681561534934,66260
5.4,"Vijaykumar Vyshak to Warner,  Caught by Kohli!! A maiden IPL wicket for Vyshak and this is a moment to cherish. Huge huge wicket for the Royal Challengers and they're jumping for joy. Warner looks stunned, has a look at his bat and walks away - short of a good length and angling across the left-hander, don't think it came on as well as Warner expected, was through with the shot early and toe-ended the lob towards mid-wicket, Kohli ran in and completed an easy catch, RCB right on top now. ",1681561539011,66260
5.4,,1681561652641,66260
5.5," Vijaykumar Vyshak to Abishek Porel, 1 run, almost another, another leading edge on the flick and Abishek has just got enough to clear Maxwell, running back from mid-off - short of a good length and angling briskly across the left-hander, hurried Abishek on the tuck and nearly had him ",1681561658061,66260
5.5," Vijaykumar Vyshak to Abishek Porel, 1 run, almost another, another leading edge on the flick and Abishek has just got enough to clear Maxwell, running back from mid-off - short of a good length and angling briskly across the left-hander, hurried Abishek on the tuck and nearly had him ",1681561658061,66260
5.6," Vijaykumar Vyshak to Manish Pandey, 1 run, short of a good length and at the stumps, worked in front of square on the on-side for a single ",1681561697650,66260
5.6,,1681561697660,66260
5.6,"A run-out check, Abishek Porel was coming back for the third, has he made his ground? The TV umpire will have a look, he did slide in and that has saved him, in by a frame. But is the bat in the air? Gough looks at a few replays and deems he's in - NOT OUT is the call",1681561703650,66260
5.6,,1681561760700,66260
6.1,"Shahbaz Ahmed to Manish Pandey, 3 runs, A run-out check, Abishek Porel was coming back for the third, has he made his ground? The TV umpire will have a look, he did slide in and that has saved him, in by a frame. But is the bat in the air? Gough looks at a few replays and deems he's in - NOT OUT is the call. Was a well flighted delivery on middle and leg, Manish went deep in the crease, used the pace and nudged it very fine - long chase for Harshal and he did well to make the stop",1681561858125,66260
6.1, This is the first time a team has lost four wickets within the powerplay this season.,1681561858135,66260
6.2," Shahbaz Ahmed to Abishek Porel, 1 run, flighted delivery on off, punched down to long-on for a single ",1681561891018,66260
6.3," Shahbaz Ahmed to Manish Pandey, , , a real dragdown from Shahbaz, short and at the stumps, Manish rocks back and then thumps the pull past square leg for a boundary ",1681561922213,66260
6.4," Shahbaz Ahmed to Manish Pandey, 1 run, flighted delivery on middle and leg, worked in front of square on the on-side for a single ",1681561950161,66260
6.5," Shahbaz Ahmed to Abishek Porel, 1 run, Shahbaz tosses one just outside off - his Bengal mate pushes it wide of cover-point for a single ",1681561977504,66260
6.6," Shahbaz Ahmed to Manish Pandey, 1 run, , flighted delivery on middle, Manish goes right back and works it through mid-wicket for a single ",1681562008198,66260
6.6,Time for Wanindu Hasaranga,1681562011198,66260
6.6,,1681562062655,66260
7.1,"Hasaranga to Manish Pandey, , .. and he starts with a real long hop, dragged way too short - Manish rocks back and then hammers the pull wide of mid-wicket, split the two fielders in the deep to perfection",1681562085329,66260
7.2," Hasaranga to Manish Pandey, no run, flighted delivery on off, Manish backs away and picks out cover-point with the punch ",1681562110864,66260
7.3," Hasaranga to Manish Pandey, no run, slower and just outside off - Manish leans across and drops it to the off-side, wanted a single and is turned back ",1681562125996,66260
7.4," Hasaranga to Manish Pandey, 2 runs, the wrong 'un from Hasaranga, Manish played with the turn and worked it in front of square on the on-side, runs hard and comes back for the second ",1681562166873,66260
7.5," Hasaranga to Manish Pandey, 1 run, the leg-break now, but the length is short and it allows Manish to go back on the drive to long-on ",1681562185971,66260
7.6," Hasaranga to Abishek Porel, 1 run, tossed up on middle, Abishek goes well back and picks out mid-wicket ",1681562225401,66260
7.6," Hasaranga to Abishek Porel, 1 run, tossed up on middle, Abishek goes well back and picks out mid-wicket ",1681562225401,66260
7.6,"Harshal, from round the wicket",1681562228401,66260
7.6,,1681562268981,66260
8.1," Harshal Patel to Abishek Porel, 1 run, on a good length and just outside off, steered behind square on the off-side for a single ",1681562322781,66260
8.1, Surely RCB can't bottle this now,1681562322782,66260
8.2," Harshal Patel to Manish Pandey, 1 run, short of a good length and just outside off, Manish hops across and works it to mid-on for a single ",1681562377535,66260
8.3," Harshal Patel to Abishek Porel, no run, on a length and angling across the left-hander, Abishek chops it hard and on the bounce to backward point ",1681562430706,66260
8.4," Harshal Patel to Abishek Porel, no run, fraction fuller and angling across the left-hander - Abishek is rooted to the crease as he aims an expansive drive and is beaten on the top-edge ",1681562464470,66260
8.4," Harshal Patel to Abishek Porel,  Caught!! ",1681562517563,66260
8.5," Harshal Patel to Abishek Porel,  Caught by Parnell!! Another leading edge and Abishek has holed out to mid-on - was a slower full-toss, dipped onto Abishek and messed up with his timing - he was looking to whip, gets undone by the late dip and is through with the shot early, pops off the leading edge and it's another simple catch to Parnell, right at the edge of the ring. DC slipping from bad to worse.  ",1681562519905,66260
8.5,"Time for the  - RCB have taken complete control over the match, but they can't sit easy, with the likes of Lalit and Axar still to come and Manish Pandey looking solid. Rawat set the pace with that superb piece of fielding and they haven't let the intensity slip until now",1681562522905,66260
8.5,,1681562733403,66260
8.6," Harshal Patel to Axar, no run, fuller length delivery outside off, Axar leans into the drive and finds cover ",1681562740730,66260
8.6,Vyshak back,1681562743730,66260
8.6,,1681562797066,66260
9.1," Vijaykumar Vyshak to Manish Pandey, no run, short of a good length and just outside off - Manish prods forward and gets an inside edge that rolled back at the bowler ",1681562799152,66260
9.2," Vijaykumar Vyshak to Manish Pandey, no run, banged in short, , Manish watches it late and ducks in a hurry ",1681562833623,66260
9.3," Vijaykumar Vyshak to Manish Pandey, 1 run, slower short ball outside off, saw Manish coming down the pitch and attempted the variation - swatted to the right of long-obn where Faf sprints across and keeps them down to a single ",1681562869912,66260
9.4," Vijaykumar Vyshak to Axar, 1 run, short of a good length and just outside off, cut away in front of square on the off-side for a single ",1681562919814,66260
9.5," Vijaykumar Vyshak to Manish Pandey, 1 run, back of a length and well wide of off, cut away square on the off-side for a single ",1681562958369,66260
9.6," Vijaykumar Vyshak to Axar, 1 run, Vyshak shortens the length around off, Axar was playing from the crease and gets an inside edge onto his pad, rolled to the off-side for a single ",1681563001790,66260
9.6," Vijaykumar Vyshak to Axar, 1 run, Vyshak shortens the length around off, Axar was playing from the crease and gets an inside edge onto his pad, rolled to the off-side for a single ",1681563001790,66260
9.6,,1681563074182,66260
10.1," Hasaranga to Axar, 2 runs, 88.4kph, length ball turning in around off, Axar pulls it hard and it takes a brilliant stop from Kohli to deny him a boundary. Lovely diving effort charging across from deep midwicket ",1681563080251,66260
10.2," Hasaranga to Axar, , googly on leg, and now Axar finds the gap as he nails the pull! Nothing Kohli could do about it ",1681563084603,66260
10.3," Hasaranga to Axar, 1 run, pulled in the air, goes on the bounce to Kohli at deep midwicket ",1681563117090,66260
10.4," Hasaranga to Manish Pandey, 1 run, floated up on off, quite full, Pandey knocks it to long-on ",1681563146783,66260
10.5,"Hasaranga to Axar, , overpitched outside off and Axar !It's a googly that's floated up outside off, doesn't get the length right and disappears to the fence. Hasaranga isn't quite on top of his game out there. His lengths are either too short, or too full",1681563175969,66260
10.6," Hasaranga to Axar, 1 run, flat on leg, on the shorter side, Axar pulls it to deep square leg ",1681563201949,66260
10.6,Harshal from round the wicket,1681563207949,66260
10.6,,1681563281267,66260
11.1," Harshal Patel to Axar, 1 run, 135kph, full delivery slanted in on off, Axar knocks it to long-on ",1681563283912,66260
11.2," Harshal Patel to Manish Pandey, 1 run, 137.5kph, back of a length outside off, Pandey punches it to long-off. He was round the wicket to Axar, and over the wicket for Pandey ",1681563315828,66260
11.3," Harshal Patel to Axar, no run, slower ball dipping around off, Axar knocks it down the pitch in defence ",1681563349078,66260
11.4," Harshal Patel to Axar, 1 run, 139.1kph, length ball slanted into the pads, Axar clips it behind square for one ",1681563387820,66260
11.4, Axar Patel should have come up in the batting order for DC. He has performed consistently this season till now.,1681563387821,66260
