over_number,commentary_data,timestamp,match_id
11.5," Harshal Patel to Manish Pandey, , banged in short, Pandey ducks and it's called wide. Maybe too high? Might've also been because it finished outside leg, not sure ",1681563426870,66260
11.5," Harshal Patel to Manish Pandey, 1 run, 134.1kph, length ball slanted into Pandey, denying him the room as he gives charge. He drags it off the inside half behind square ",1681563463886,66260
11.6," Harshal Patel to Axar, 1 run, slower one around off, Axar looks to drive, is early through the shot and drags it through midwicket ",1681563496454,66260
11.6,,1681563585323,66260
12.1," Vijaykumar Vyshak to Axar, , 143.2kph, short of length outside off, Axar goes hard at it and flat-bats it over mid-off ",1681563589143,66260
12.1,Third man comes up and mid-off goes back,1681563592143,66260
12.1,Third man comes up and mid-off goes back,1681563592143,66260
12.1," Vijaykumar Vyshak to Axar,  Caught!! ",1681563632206,66260
12.2," Vijaykumar Vyshak to Axar,  Caught by Siraj!! ! Big wicket! He floats it up on a good length outside off, Axar looks to loft down the ground but he's through the shot early. Goes high off the toe-end, and Siraj hangs onto a good catch as he pedals back from extra cover. Axar has been among the runs, and getting rid of him means that victory is well in sight now.  ",1681563633933,66260
12.2,,1681563706000,66260
12.3," Vijaykumar Vyshak to Aman Hakim Khan, 1 run, short of length into the body, Aman pulls it to fine leg ",1681563726524,66260
12.4," Vijaykumar Vyshak to Manish Pandey, no run, short of length outside off, Pandey dabs it late but finds short third ",1681563758542,66260
12.5," Vijaykumar Vyshak to Manish Pandey, no run, slower length ball wide of off, Pandey looks to cut but it stays low and sneaks through to the keeper ",1681563798415,66260
12.6," Vijaykumar Vyshak to Manish Pandey, 1 run, 137.7kph, speared in full just outside off, Pandey drives powerfully to long-on. He couldn't get under the ball there as Vyshak got it right up ",1681563838313,66260
12.6, DC have good players in all departments but they somehow are lacking the glue binding them. That's the reason they are winless.,1681563838314,66260
12.6,,1681563898546,66260
13.1," Hasaranga to Manish Pandey, no run, 90.5kph, flat leg-break around middle, Pandey steps out, doesn't get anywhere close to the pitch and tries to defend. Gets an inside edge onto pad ",1681563901764,66260
13.2," Hasaranga to Manish Pandey, , this time he does get to the pitch after using his feet and drills it down the ground! He has to up the ante now with wickets falling around him ",1681563925561,66260
13.3," Hasaranga to Manish Pandey, , there he goes again! Tell you what, he wasn't anywhere close to the pitch of it, but still manages to whack it over midwicket! It's a googly that's well wide of off, Pandey advances, has to reach out and somehow clobbers it over the ropes ",1681563951786,66260
13.4," Hasaranga to Manish Pandey, , flat on leg, pushed through by Hasaranga and Pandey uses the pace nicely to whip it past backward square ",1681563993414,66260
13.5," Hasaranga to Manish Pandey, 2 runs, flat on the pads, Pandey nudges it through the on-side and charges back for two.  for him ",1681564029601,66260
13.5,"A review for LBW! Flat length ball sliding in, Pandey looks to nudge it through the on-side",1681564032601,66260
13.5," Hasaranga to Manish Pandey,  Lbw!! ",1681564158742,66260
13.6," Hasaranga to Manish Pandey,  Lbw!! A review for LBW! Flat length ball sliding in, Pandey looks to nudge it through the on-side but misses. He's not too concerned, calmly taking a sip from a bottle of water. But that's when he hears the roar. The ball is crashing into the top of leg stump. Was originally given not out, and ball-tracking seems to have taken quite a few by surprise out there. Pandey gets to fifty, and then gets out the very next ball.  ",1681564163197,66260
13.6,,1681564163207,66260
13.6,,1681564232557,66260
13.6,,1681564236606,66260
13.6,,1681564236606,66260
14.1," Parnell to Aman Hakim Khan, 1 run, short of length at the body, Aman tucks it through midwicket ",1681564256187,66260
14.1, DC's spinners ruled the roost whereas it is the pacers for RCB today. You cannot look too much into the pitch if you bowl to your strengths!,1681564256188,66260
14.2," Parnell to Lalit Yadav, 1 run, short of length around the chest, pulled to deep backward square ",1681564294450,66260
14.3," Parnell to Aman Hakim Khan, , slower short ball around the chest, sits up for Aman who swivels across and pulls it over long leg ",1681564337154,66260
14.4," Parnell to Aman Hakim Khan, no run, 135.3kph, short of length around middle, Aman punches it gently down the pitch ",1681564369255,66260
14.5," Parnell to Aman Hakim Khan, 1 run, 138.2kph, short of length at the body, Aman pulls it to deep backward square ",1681564403858,66260
14.5," What a debut has this been for the youngster Vyshak, economical and two key wickets of Warner and Axar, just when they started to look threatening in key phases of the game",1681564403859,66260
14.6," Parnell to Lalit Yadav, 1 run, 121kph, short of length outside off, Lalit dabs it in front of backward point ",1681564442875,66260
14.6,,1681564508730,66260
15.1," Vijaykumar Vyshak to Lalit Yadav, 2 runs, slower one outside off, Lalit gets low and drags the sweep through midwicket. No timing on it but it's in the gap and they get two ",1681564514425,66260
15.2," Vijaykumar Vyshak to Lalit Yadav, no run, slower bouncer that's well wide of off, Lalit lets it go and it seems to be just outside the marker. But the umpire doesn't signal a wide ",1681564561053,66260
15.3," Vijaykumar Vyshak to Lalit Yadav, no run, slower length ball outside off, driven to extra cover ",1681564583304,66260
15.4," Vijaykumar Vyshak to Lalit Yadav, no run, 127.1kph, length ball slanted in around off, Lalit swings across the line and  ",1681564617546,66260
15.4," Vijaykumar Vyshak to Lalit Yadav,  Caught!! ",1681564667751,66260
15.5,"Vijaykumar Vyshak to Lalit Yadav,  Caught by Maxwell!! Another one for Vyshak who's having a great time on his IPL debut! Slower knuckle ball outside off, it's in the slot for Lalit who slaps it hard. Goes straight to long-off! ",1681564671058,66260
15.5,Timeout!,1681564674058,66260
15.5,,1681564872880,66260
15.6," Vijaykumar Vyshak to Nortje, 1 run, short of length outside off, steered wide of short third who makes a diving stop!  ",1681564894849,66260
15.6,,1681564960259,66260
16.1," Harshal Patel to Nortje, 1 run, yorker around off, Nortje squeezes it through the off-side ",1681564963190,66260
16.2," Harshal Patel to Aman Hakim Khan, 2 runs, 135.6kph, goes for another yorker but is slightly short of the mark. Aman slices it through backward point ",1681564992782,66260
16.2," Harshal Patel to Aman Hakim Khan, 2 runs, 135.6kph, goes for another yorker but is slightly short of the mark. Aman slices it through backward point ",1681564992782,66260
16.3," Harshal Patel to Aman Hakim Khan, , 123kph, overpitched outside off, and Aman hammers it over extra cover ",1681565033638,66260
16.4," Harshal Patel to Aman Hakim Khan, , wide yorker attempted, fails to keep it inside the marker and Aman leaves it alone ",1681565082348,66260
16.4," Harshal Patel to Aman Hakim Khan, 2 runs, 138.3kph, again he misses the mark with his attempted yorker, bowls a half-volley outside off and Aman crashes it through extra cover. The fielder in the ring got a hand diving across ",1681565113036,66260
16.4," RCB showing the true value of playing at their fortress, which was needed from the perspective of a RCB fan as they play their first 6/8 matches at M. Chinnaswamy.",1681565113037,66260
16.5," Harshal Patel to Aman Hakim Khan, 1 run, slower dipping full toss on off, Aman swings and toe-ends it to long-on ",1681565155099,66260
16.6," Harshal Patel to Nortje, 1 run, another dipping full toss, takes Nortje by surprise but he manages to knock it down the ground ",1681565195458,66260
16.6," A player getting injured, replacement player comes in and straight away makes an impact, this sounds way familiar for RCB fans, last year it was Rajat Patidar, this year it seems to be Vijaykumar Vyshak",1681565195459,66260
16.6,,1681565230262,66260
17.1," Siraj to Nortje, , 140.1kph, back of a length delivery just outside off, Nortje flashes hard and itB1$. Nothing the keeper can do ",1681565275457,66260
17.1,Third man pushed back to the boundary.,1681565278457,66260
17.2," Siraj to Nortje, 1 run, goes straight to that fielder who was pushed back. Back of a length just outside off, Nortje opens the face and the edge travels quickly to third man ",1681565315472,66260
17.2," Siraj to Aman Hakim Khan,  Caught!! ",1681565359123,66260
17.3," Siraj to Aman Hakim Khan,  Caught by Kohli!! Banged into the pitch on a short of length! Aman looks to pull down the ground, connects, but fails to clear Kohli at long-on. He's been busy on the field, egging the crowd on when not taking catches and diving around. His third catch of the evening.  ",1681565362580,66260
17.3,,1681565419585,66260
17.4," Siraj to Kuldeep Yadav, no run, back of a length across off, Kuldeep looks to open the face in order to guide it towards third man. Beaten! ",1681565433812,66260
17.5," Siraj to Kuldeep Yadav, 1 run, full on middle and leg, Kuldeep flicks it through square leg ",1681565469996,66260
17.6," Siraj to Nortje, 1 run, low full toss at the stumps, Nortje drives to long-on ",1681565507911,66260
17.6, Vyshak was hit for only two boundaries and he came back and took a wicket on the very next ball on both the occasions. Dream debut!,1681565507912,66260
17.6,Parnell from round the wicket,1681565510911,66260
17.6,,1681565568846,66260
18.1," Parnell to Nortje, no run, back of a length around off, Nortje looks to cut and chops it off a thick under-edge to short fine ",1681565579034,66260
18.2," Parnell to Nortje, , slower short ball outside off, Nortje frees his arms and slaps it through extra cover ",1681565596966,66260
18.2," Parnell to Nortje, , slower short ball outside off, Nortje frees his arms and slaps it through extra cover ",1681565596966,66260
18.2," Parnell to Nortje, , slower short ball outside off, Nortje frees his arms and slaps it through extra cover ",1681565596966,66260
18.3," Parnell to Nortje, , four more! Short of length into the body, Nortje pulls it through square leg and it bounces just short of the ropes ",1681565626035,66260
18.3," Parnell to Nortje, , four more! Short of length into the body, Nortje pulls it through square leg and it bounces just short of the ropes ",1681565626035,66260
18.4," Parnell to Nortje, no run, Parnell hits back with a sharp yorker that hits Nortje on the pad as he's late on it. No appeal as it was going down leg ",1681565659704,66260
18.4," Parnell to Nortje, no run, Parnell hits back with a sharp yorker that hits Nortje on the pad as he's late on it. No appeal as it was going down leg ",1681565659704,66260
18.5," Parnell to Nortje, no run, full delivery slanted in, again Nortje is struck on the pad as he swings and misses ",1681565691257,66260
18.5," Parnell to Nortje, no run, full delivery slanted in, again Nortje is struck on the pad as he swings and misses ",1681565691257,66260
18.6," Parnell to Nortje, 1 run, Nortje advances, Parnell goes short into his body and it results in a mistimed pull through square leg ",1681565730345,66260
18.6," Parnell to Nortje, 1 run, Nortje advances, Parnell goes short into his body and it results in a mistimed pull through square leg ",1681565730345,66260
18.6,,1681565773871,66260
18.6,,1681565773871,66260
19.1," Harshal Patel to Nortje, , banged in short, Nortje advances and pulls through midwicket ",1681565778706,66260
19.1," Harshal Patel to Nortje, , banged in short, Nortje advances and pulls through midwicket ",1681565778706,66260
19.2," Harshal Patel to Nortje, 1 run, full toss on leg, driven to long-on ",1681565816144,66260
19.2," Harshal Patel to Nortje, 1 run, full toss on leg, driven to long-on ",1681565816144,66260
19.3," Harshal Patel to Kuldeep Yadav, no run, slower dipping yorker on off, Kuldeep squeezes it out ",1681565849754,66260
19.3," Harshal Patel to Kuldeep Yadav, no run, slower dipping yorker on off, Kuldeep squeezes it out ",1681565849754,66260
19.4," Harshal Patel to Kuldeep Yadav, 2 runs, ! It loops over the fielder at extra cover and falls safely ",1681565890950,66260
19.4," Harshal Patel to Kuldeep Yadav, 2 runs, ! It loops over the fielder at extra cover and falls safely ",1681565890950,66260
19.5," Harshal Patel to Kuldeep Yadav, , 121.5kph, full toss on the pads, and Kuldeep whips it through square leg ",1681565919512,66260
19.5," Harshal Patel to Kuldeep Yadav, , 121.5kph, full toss on the pads, and Kuldeep whips it through square leg ",1681565919512,66260
19.6," Harshal Patel to Kuldeep Yadav, , slower ball quite wide outside off, Kuldeep leaves it alone, and the umpire's raises his arms to signal a wide ",1681565958823,66260
19.6," Harshal Patel to Kuldeep Yadav, , slower ball quite wide outside off, Kuldeep leaves it alone, and the umpire's raises his arms to signal a wide ",1681565958823,66260
19.6," Harshal Patel to Kuldeep Yadav, no run, slower length ball angled in, Kuldeep swings and misses, and it bounces over the stumps! All over!  ",1681565982803,66260
19.6," Harshal Patel to Kuldeep Yadav, no run, slower length ball angled in, Kuldeep swings and misses, and it bounces over the stumps! All over!  ",1681565982803,66260
post," What a performance from the RCB seamers to defend the total convincingly! RCB were really poor with the way they handled things with the bat towards the end of their innings, and how they used their impact sub. But that seems a long time ago now. Their bowling, which is often accused of not stepping up, bailed them out today. Majority of the damage was done in the powerplay itself with Siraj and Parnell steaming in as the Capitals were reduced to 2/3. And then came Vijaykumar Vyshak to produce a brilliant spell on debut! He got rid of David Warner who was starting to look dangerous, before getting rid of the in-form Axar Patel. The final nail was the wicket of Manish Pandey, getting trapped LBW by Hasaranga who wasn't having a great game until then. The pitch was on the slower side, definitely not a belter that we see in the evening games here. And the batting woes from the Capitals continued.  for them now, with things looking quite grim.",1681566036947,66260
post," What a performance from the RCB seamers to defend the total convincingly! RCB were really poor with the way they handled things with the bat towards the end of their innings, and how they used their impact sub. But that seems a long time ago now. Their bowling, which is often accused of not stepping up, bailed them out today. Majority of the damage was done in the powerplay itself with Siraj and Parnell steaming in as the Capitals were reduced to 2/3. And then came Vijaykumar Vyshak to produce a brilliant spell on debut! He got rid of David Warner who was starting to look dangerous, before getting rid of the in-form Axar Patel. The final nail was the wicket of Manish Pandey, getting trapped LBW by Hasaranga who wasn't having a great game until then. The pitch was on the slower side, definitely not a belter that we see in the evening games here. And the batting woes from the Capitals continued.  for them now, with things looking quite grim.",1681566036947,66260
post,,1681566036958,66260
post,,1681566036958,66260
post," - I didn't know about that (on having the best bowling figures on debut for an RCB bowler), have been working hard for the opportunity. Faf came and told me the wicket was holding up a bit, so I went with the hard lengths and slower balls which worked well. I've been working on these variations for the last couple of years. I wanted to bowl the knuckle ball, but Faf came up with suggestions on how to go about on this pitch. The management backed me well and Faf came up with suggestions often to help me. I was with the team as a net bowler",1681566289159,66260
post," - I didn't know about that (on having the best bowling figures on debut for an RCB bowler), have been working hard for the opportunity. Faf came and told me the wicket was holding up a bit, so I went with the hard lengths and slower balls which worked well. I've been working on these variations for the last couple of years. I wanted to bowl the knuckle ball, but Faf came up with suggestions on how to go about on this pitch. The management backed me well and Faf came up with suggestions often to help me. I was with the team as a net bowler",1681566289159,66260
post," I said at the toss we needed to do all disciplines well, but we lost three early wickets and we didn't chase down what should have been an easy chase. They (RCB) came out and started well with the ball, Siraj was outstanding. The positives were good - bowling and fielding was exceptional, the energy we showed was great too. Have to go back, we have five days off, have a hard look at ourselves, we need to do better with the bat and build partnerships at the top of the order. It is a matter of starting well with the bat. Teams have come back well from this position before and we can go on and do better.",1681566541261,66260
post," I said at the toss we needed to do all disciplines well, but we lost three early wickets and we didn't chase down what should have been an easy chase. They (RCB) came out and started well with the ball, Siraj was outstanding. The positives were good - bowling and fielding was exceptional, the energy we showed was great too. Have to go back, we have five days off, have a hard look at ourselves, we need to do better with the bat and build partnerships at the top of the order. It is a matter of starting well with the bat. Teams have come back well from this position before and we can go on and do better.",1681566541261,66260
post," We needed that to get the confidence back in the group. Especially the bowling group. Unfortunately we've had to defend for a few games in a row now, and it's not always easy at the Chinnaswamy. So very proud of them tonight. It's the first day game of the season. Also the new rule now - you always feel you need more. 175 in a day game here is a good score. But with the new rule there's some uncertainty. it proved to be the right score. But the way we bowled in the first six overs, not only today - in all the games. Siraj setting the tone beautifully. Generally the first six overs is most important with the bat. You want to play positive and get ahead of the rate. The way we bowled was just unbelievable. Huge credit to our seamers in the first six.",1681567024949,66260
post," We needed that to get the confidence back in the group. Especially the bowling group. Unfortunately we've had to defend for a few games in a row now, and it's not always easy at the Chinnaswamy. So very proud of them tonight. It's the first day game of the season. Also the new rule now - you always feel you need more. 175 in a day game here is a good score. But with the new rule there's some uncertainty. it proved to be the right score. But the way we bowled in the first six overs, not only today - in all the games. Siraj setting the tone beautifully. Generally the first six overs is most important with the bat. You want to play positive and get ahead of the rate. The way we bowled was just unbelievable. Huge credit to our seamers in the first six.",1681567024949,66260
post," It was a tricky one. When it went up in the air, I made sure there was no one close to me. I made sure I grabbed it solidly. I was quite disappointed that I got out to a full toss. I've been playing really well. I wanted to make sure that after fifty, I was targetting 30-35 runs off the next 10 balls. That's how I play. That would've helped us get past 200. One thing I mentioned to the guys in the change room that 175 was enough on this pitch. It slowed down considerably when the spinners came on. Even the balls to hit off the back foot off Kuldeep were holding up, unlike the other games we played. We did well to get to that score and had the belief it was enough. When I've played my best cricket, those are the balls I've put away consistently (length balls on the up). That helps me to put pressure on the bowlers. When I put away their best balls, they're going to try to do something else. I back myself to hit good balls and the best bowlers in the opposition. That's how I motivate myself to play out there. Very happy to get two points. We kind of let it slip away last two games. For us to bounce back like this was very crucial. That was a different mentality and phase altogether (T20 World Cup 2016 semis). I was in a space where I felt I could hit any ball. I back myself to hit good shots. When they come off they look good.",1681567143953,66260
post," It was a tricky one. When it went up in the air, I made sure there was no one close to me. I made sure I grabbed it solidly. I was quite disappointed that I got out to a full toss. I've been playing really well. I wanted to make sure that after fifty, I was targetting 30-35 runs off the next 10 balls. That's how I play. That would've helped us get past 200. One thing I mentioned to the guys in the change room that 175 was enough on this pitch. It slowed down considerably when the spinners came on. Even the balls to hit off the back foot off Kuldeep were holding up, unlike the other games we played. We did well to get to that score and had the belief it was enough. When I've played my best cricket, those are the balls I've put away consistently (length balls on the up). That helps me to put pressure on the bowlers. When I put away their best balls, they're going to try to do something else. I back myself to hit good balls and the best bowlers in the opposition. That's how I motivate myself to play out there. Very happy to get two points. We kind of let it slip away last two games. For us to bounce back like this was very crucial. That was a different mentality and phase altogether (T20 World Cup 2016 semis). I was in a space where I felt I could hit any ball. I back myself to hit good shots. When they come off they look good.",1681567143953,66260
post,"The way RCB bowled today should do their confidence a world of good, given how their last couple of matches had gone. Capitals, though, continue to remain down in the dumps. The batting is just not firing, and it's five defeats in five matches now. So that's all from this game. The other match between LSG and PBKS is already underway in Lucknow. Hop tabs to catch all the action. This is Sagar Chawla signing off on behalf of Venky, Saurabh Shankar, Nikhil Jadhav and Pradeep Krishnamurthy.",1681567446211,66260
post,"The way RCB bowled today should do their confidence a world of good, given how their last couple of matches had gone. Capitals, though, continue to remain down in the dumps. The batting is just not firing, and it's five defeats in five matches now. So that's all from this game. The other match between LSG and PBKS is already underway in Lucknow. Hop tabs to catch all the action. This is Sagar Chawla signing off on behalf of Venky, Saurabh Shankar, Nikhil Jadhav and Pradeep Krishnamurthy.",1681567446211,66260
