over_number,commentary_data,timestamp,match_id
12.2," Markande to Nitish Rana, , ah that's too full, and Rana is hitting it too well to miss out! Floated up on off, doesn't matter which way it's turning because it's so full, and Rana lofts it for a big six ",1681491550955,66257
12.3," Markande to Nitish Rana, 1 run, goes for a reverse-sweep but is hit on the pad! Markande goes up in appeal! Think he's got bat on it though. Oh yes, the umpire gives it as runs, and SRH don't challenge the call either ",1681491619651,66257
12.4," Markande to Rinku Singh, 1 run, steps out, gets too close to the pitch and drills it to long-on ",1681491634774,66257
12.5," Markande to Nitish Rana, no run, goes for the reverse-sweep, hits it well but finds backward point ",1681491643026,66257
12.6," Markande to Nitish Rana, no run, googly outside off, turns away off a length, Rana looks to cut but is beaten! ",1681491663335,66257
12.6,,1681491746168,66257
13.1," T Natarajan to Rinku Singh, 1 run, back of a length delivery slanted in on leg, Rinku plays a short-arm jab and mistimes it through square leg ",1681491754160,66257
13.2," T Natarajan to Nitish Rana, 1 run, 131.1kph, pitched right up on off, Rana squeezes it to long-on ",1681491789580,66257
13.3," T Natarajan to Rinku Singh, no run, 135kph, overpitched on leg stump, Rinku flicks it to square leg ",1681491822068,66257
13.4," T Natarajan to Rinku Singh, , ah there we go again! Rinku Singh clearing the boundary! Full in the slot around off, Rinku clears the front leg and hammers it over long-on. It goes way back in the stands ",1681491867747,66257
13.4,"Chants of Rinku, Rinku from this packed crowd",1681491870747,66257
13.5," T Natarajan to Rinku Singh, , banged in short, too high, sails over Rinku's head ",1681491924607,66257
13.5," T Natarajan to Rinku Singh, 1 run, 133.6kph, almost in the blockhole on off, Rinku squeezes it to long-off ",1681491957487,66257
13.6," T Natarajan to Nitish Rana, , makes room to drive through extra cover. Instead it goes running away off a thick inside edge through square leg. Natarajan can only stand with his hands on hips. He did well to follow Rana with a full delivery, inducing the error, but it still finds the ropes ",1681491998646,66257
13.6,,1681492093105,66257
14.1," Bhuvneshwar to Rinku Singh, no run, slower length ball wide of off, Rinku reaches out and mistimes the cut to point ",1681492107986,66257
14.1," Bhuvneshwar to Rinku Singh, no run, slower length ball wide of off, Rinku reaches out and mistimes the cut to point ",1681492107986,66257
14.2," Bhuvneshwar to Rinku Singh, no run,  Massive moment in this game! It's a very full delivery around middle, Rinku swings across the line, he's early through the shot and it takes the toe-end. But it bounces straight into the pitch before going to the keeper. The decision will be reversed, much to the delight of the crowd ",1681492233309,66257
14.3," Bhuvneshwar to Rinku Singh, , low full toss on the pads, Rinku flicks it nicely and gets it away past short fine! ",1681492257844,66257
14.4," Bhuvneshwar to Rinku Singh, 1 run, wide yorker outside off, Rinku reaches out and squeezes it to short third off the toe-end ",1681492297291,66257
14.5," Bhuvneshwar to Nitish Rana, 1 run, slower length ball outside off, Rana looks to slog and drags it off the inside half to deep midwicket ",1681492330641,66257
14.6," Bhuvneshwar to Rinku Singh, 1 run, slower length ball outside off, Rinku flat-bats it to long-off for a single. Just 7 off the over with the asking rate now over 17 ",1681492361752,66257
14.6,"After what he did the last match, you're almost scared to ask how much is too much. But with 87 needed off 30, it does look like too much to do.",1681492364752,66257
14.6, Honestly it's time to give chance to Wiese in place of Russell. Most importantly he can bowl full quota of his over and he can finish the game,1681492364753,66257
14.6,,1681492443367,66257
15.1," Marco Jansen to Rinku Singh, 1 run, Rinku steps out, backs away and Jansen does a brilliant job following him. Low full toss on the pads, Rinku is rushed on the shot, chips it in the air and it  ",1681492453580,66257
15.2," Marco Jansen to Nitish Rana, , full toss down the leg-side, Rana swings and misses ",1681492491470,66257
15.2," Marco Jansen to Nitish Rana, no run, banged in short, might've been a cutter from Jansen and Rana is through the pull too early! He doesn't make contact as it dies through to the keeper ",1681492524664,66257
15.3," Marco Jansen to Nitish Rana, , ah that's a harsh call from the umpire. Slower one angled in, Rana moves across the stumps, looks to sweep and misses. It only just misses leg stump. No surprise that SRH have gone for a review against the wide call. Now this is interesting, the third umpire upholds the decision, despite the fact that Rana clearly stepped across the stumps. Had he stayed in his original stance, it would've easily hit him on the pad ",1681492564970,66257
15.3," Marco Jansen to Nitish Rana, no run, Rana backs away, Jansen follows him and Rana mistimes the drive to mid-off ",1681492647358,66257
15.4," Marco Jansen to Nitish Rana, 1 run,  Some of the catching tonight has been really poor! It's Washington Sundar this time who fails to hold on. Slower bouncer, Rana looks to pull, skies it off a thick top-edge. It goes very high and Washington has a lot of time to settle under it. But he puts it down ",1681492686864,66257
15.5," Marco Jansen to Rinku Singh, no run, cracking yorker, Rinku squeezes it to point ",1681492727365,66257
15.6," Marco Jansen to Rinku Singh, , , full toss on the pads,  He swings hard and whacks it over square leg. And to make things worse, it's a no ball ",1681492801064,66257
15.6," Marco Jansen to Rinku Singh, , another six! Another six from Rinku Singh, his third of the night! Slower one outside off, Jansen tries to keep it out of his reach, but Rinku is still able to get to it. He reaches out and clobbers it over extra cover. Here we go again ",1681492843074,66257
15.6,"Timeout! 70 needed off 24, required rate of 17.5, and yet KKR are not out of it. This is within RInku Singh territory",1681492846074,66257
15.6,,1681493019714,66257
15.6, Has to be said that Nitish Rana has stepped up beautifully in Shreyas Iyer's absence for KKR,1681493019715,66257
16.1," T Natarajan to Nitish Rana, no run, quite full around off, Rana looks for a reverse-scoop but misses. The ball only just misses off stump by a whisker ",1681493046619,66257
16.1," T Natarajan to Nitish Rana, no run, quite full around off, Rana looks for a reverse-scoop but misses. The ball only just misses off stump by a whisker ",1681493046619,66257
16.2," T Natarajan to Nitish Rana, , Natarajan misses the yorker, offers a full toss and gets hammered down the ground! Rana with a clean swing of the blade sends it sailing into the crowd ",1681493085004,66257
16.2," T Natarajan to Nitish Rana,  Caught!! ",1681493135861,66257
16.3," T Natarajan to Nitish Rana,  Caught by Washington Sundar!! Full toss again, but Rana hits it straight to hand this time! Line is outside off, he goes hard at it and smashes it to sweeper cover. No mistake from Washington this time. Oh Nitish Rana. He played so well, and has got out to such a hittable delivery.  ",1681493137616,66257
16.3,,1681493172101,66257
16.4," T Natarajan to Thakur, 1 run, brilliant yorker on leg, Thakur squeezes it through square leg ",1681493233994,66257
16.5," T Natarajan to Rinku Singh, 1 run, low full toss outside off, slapped to deep point ",1681493273970,66257
16.6," T Natarajan to Thakur, , ! Low full toss down leg, Thakur only has to get some bat and it runs away past short fine leg ",1681493304350,66257
16.6,,1681493345762,66257
17.1," Bhuvneshwar to Rinku Singh, , Bhuvneshwar goes for a wide yorker but fails to keep it within the marker. Rinku leaves it alone ",1681493377323,66257
17.1,"This is Bhuvi's last over. The options for SRH after this are Natarajan and Umran, unless they go to spin which will probably won't happen",1681493380323,66257
17.1," Bhuvneshwar to Rinku Singh, 1 run, low full toss on the pads, Rinku flicks it through midwicket ",1681493407241,66257
17.2," Bhuvneshwar to Thakur, ,  Slower length ball, Thakur swings hard, gets deceived by the lack of pace but gets four anyway ",1681493448855,66257
17.3," Bhuvneshwar to Thakur, no run, slower leg-cutter wide of off, Thakur looks to slog but he's beaten! Brilliant from Bhuvneshwar to keep it out of his reach ",1681493484460,66257
17.4," Bhuvneshwar to Thakur, 1 run, banged in short now to vary it up. Lovely stuff. Thakur mistimes the pull through midwicket ",1681493521841,66257
17.5," Bhuvneshwar to Rinku Singh, 1 run, low full toss on the pads, Rinku flicks it to square leg and goes through for the single. Direct hit would've probably had him ",1681493562544,66257
17.6," Bhuvneshwar to Thakur, 2 runs,  Slower leg-cutter outside off, Thakur swings hard, and slices it in the air over extra cover. Markram has to run back from the circle as he goes after it. Would it have been easier for the converging fielder running in from the ropes? But Markram calls for it, puts in a diving effort but puts it down ",1681493602295,66257
18.1," T Natarajan to Rinku Singh, 2 runs, low full toss wide of off, Rinku slices it wide of sweeper cover and charges back for two. There's a direct hit from the deep but he's home ",1681493706405,66257
18.2," T Natarajan to Rinku Singh, , another attempted wide yorker, turns out to be a low full toss and Rinku hammers it through backward point. It races away to the ropes ",1681493727382,66257
18.3," T Natarajan to Rinku Singh, 2 runs, close to the blockhole outside off, Rinku drives hard through extra cover, wants two at any cost and Shardul has to take the risk to get him back on strike. He makes it home in time ",1681493775967,66257
18.3," T Natarajan to Rinku Singh, 2 runs, close to the blockhole outside off, Rinku drives hard through extra cover, wants two at any cost and Shardul has to take the risk to get him back on strike. He makes it home in time ",1681493775967,66257
18.3," T Natarajan to Rinku Singh, 2 runs, close to the blockhole outside off, Rinku drives hard through extra cover, wants two at any cost and Shardul has to take the risk to get him back on strike. He makes it home in time ",1681493775967,66257
18.4," T Natarajan to Rinku Singh, no run,  He's late on the pull and gets hit on the glove. Shardul runs halfway down for a single but RInku sends him back ",1681493810551,66257
18.4," T Natarajan to Rinku Singh, no run,  He's late on the pull and gets hit on the glove. Shardul runs halfway down for a single but RInku sends him back ",1681493810551,66257
18.5," T Natarajan to Rinku Singh, , oh that's not a bad ball. Goes for a yorker on middle, gets it very full to stop Rinku from getting under it. But Rinku powerfully swipes it through midwicket for four ",1681493854197,66257
18.5," T Natarajan to Rinku Singh, , oh that's not a bad ball. Goes for a yorker on middle, gets it very full to stop Rinku from getting under it. But Rinku powerfully swipes it through midwicket for four ",1681493854197,66257
18.5, Excellent match-winning spell from Bhuvi! He has redeemed his death bowling ability,1681493854198,66257
18.5, Excellent match-winning spell from Bhuvi! He has redeemed his death bowling ability,1681493854198,66257
18.6," T Natarajan to Rinku Singh, , dropped! Glenn Phillips has dropped a sitter! Short of length around the waist, Rinku mistimes the pull in the air, should've been swallowed at deep midwicket. But Phillips, one of the best on the outfield, makes a mess of it.  ",1681493909578,66257
18.6," T Natarajan to Rinku Singh, , dropped! Glenn Phillips has dropped a sitter! Short of length around the waist, Rinku mistimes the pull in the air, should've been swallowed at deep midwicket. But Phillips, one of the best on the outfield, makes a mess of it.  ",1681493909578,66257
18.6,They needed 29 the other day. It's 32 today.,1681493912578,66257
18.6,They needed 29 the other day. It's 32 today.,1681493912578,66257
18.6,,1681493961822,66257
18.6,,1681493961822,66257
18.6," Umran Malik to Thakur,  Caught!! ",1681494014342,66257
18.6," Umran Malik to Thakur,  Caught!! ",1681494014342,66257
19.1," Umran Malik to Thakur,  Caught by Washington Sundar!! That should be the game for SRH! They now need 32 off 5, even RInku Singh can't do much about that. Slower length ball outside off, Thakur looks to slog and gets a thick edge. Comfortably taken at backward point.  ",1681494017805,66257
19.1," Umran Malik to Thakur,  Caught by Washington Sundar!! That should be the game for SRH! They now need 32 off 5, even RInku Singh can't do much about that. Slower length ball outside off, Thakur looks to slog and gets a thick edge. Comfortably taken at backward point.  ",1681494017805,66257
19.1,,1681494092849,66257
19.1,,1681494092849,66257
19.2," Umran Malik to Umesh Yadav, 1 run, short of length outside off, Umesh does what he does and takes a single as he taps it to point ",1681494111471,66257
19.2," Umran Malik to Umesh Yadav, 1 run, short of length outside off, Umesh does what he does and takes a single as he taps it to point ",1681494111471,66257
19.3," Umran Malik to Rinku Singh, no run, that's a good call from the umpire not to give a wide. The ball may have finished outside leg, but Rinku moved across. Length ball slanted in from round the wicket, Rinku looks to scoop but misses ",1681494169445,66257
19.3," Umran Malik to Rinku Singh, no run, that's a good call from the umpire not to give a wide. The ball may have finished outside leg, but Rinku moved across. Length ball slanted in from round the wicket, Rinku looks to scoop but misses ",1681494169445,66257
19.4," Umran Malik to Rinku Singh, no run, slower length ball outside off, Rinku pulls it on the bounce to deep square leg ",1681494202903,66257
19.4," Umran Malik to Rinku Singh, no run, slower length ball outside off, Rinku pulls it on the bounce to deep square leg ",1681494202903,66257
19.5," Umran Malik to Rinku Singh, , Rinku can't stop hitting sixes in the final over. It's off the top-edge, and goes flying over fine leg. Back of a length outside off, Rinku has a massive heave and Umran's pace takes it over ",1681494249790,66257
19.5," Umran Malik to Rinku Singh, , Rinku can't stop hitting sixes in the final over. It's off the top-edge, and goes flying over fine leg. Back of a length outside off, Rinku has a massive heave and Umran's pace takes it over ",1681494249790,66257
19.6," Umran Malik to Rinku Singh, 1 run, slower short ball wide of off, Rinku reaches out and flat-bats it to mid-off. Another brilliant knock from him tonight but it comes in a losing effort this time as SRH hold on by 23 runs ",1681494291320,66257
19.6," Umran Malik to Rinku Singh, 1 run, slower short ball wide of off, Rinku reaches out and flat-bats it to mid-off. Another brilliant knock from him tonight but it comes in a losing effort this time as SRH hold on by 23 runs ",1681494291320,66257
post," It wasn't to be for Rinku Singh tonight. The sixes still flowed from him, but it was well out of reach in the final over by the time he got on strike. It's a wonder KKR even got so close from where they were at the start of the chase. Bhuvneshwar and Jansen rattled them with the new ball as they slipped to 20/3. But a stunning counter-attack from Rana, which started with taking Umran Malik to the cleaners, and a late assault from Rinku, who else, got the crowd's hopes up. But the death bowling today was a lot better. Bhuvneshwar came back to bowl a terrific 15th and 18th over. Natarajan wasn't on the money the whole time, but he was good enough. And Umran closed it off after the early damage he took. Not to forget Mayank Markande's lovely spell through the middle as .",1681494379781,66257
post," It wasn't to be for Rinku Singh tonight. The sixes still flowed from him, but it was well out of reach in the final over by the time he got on strike. It's a wonder KKR even got so close from where they were at the start of the chase. Bhuvneshwar and Jansen rattled them with the new ball as they slipped to 20/3. But a stunning counter-attack from Rana, which started with taking Umran Malik to the cleaners, and a late assault from Rinku, who else, got the crowd's hopes up. But the death bowling today was a lot better. Bhuvneshwar came back to bowl a terrific 15th and 18th over. Natarajan wasn't on the money the whole time, but he was good enough. And Umran closed it off after the early damage he took. Not to forget Mayank Markande's lovely spell through the middle as .",1681494379781,66257
post," Thanks for the compliments on the run chase. I feel the way we bowled was not according to the plans. No matter what the wicket was like, this wasn’t a 230 wicket. One odd day you’ll get an innings like Rinku had the other day, but not everyday. We batted really well, we wanted to take the game deep and then you never know. Home advantage is one thing, but we know Eden Gardens tracks always play this way, we expected 200 to be a par score here and have been preparing that way, but we need to bowl better. Today, even the main bowlers were going for runs but I can’t be too critical because these are the same bowlers who will win me a game some other time. Very happy with the fight we showed but would have loved it more if we got two points as well.",1681494873668,66257
post," Thanks for the compliments on the run chase. I feel the way we bowled was not according to the plans. No matter what the wicket was like, this wasn’t a 230 wicket. One odd day you’ll get an innings like Rinku had the other day, but not everyday. We batted really well, we wanted to take the game deep and then you never know. Home advantage is one thing, but we know Eden Gardens tracks always play this way, we expected 200 to be a par score here and have been preparing that way, but we need to bowl better. Today, even the main bowlers were going for runs but I can’t be too critical because these are the same bowlers who will win me a game some other time. Very happy with the fight we showed but would have loved it more if we got two points as well.",1681494873668,66257
post," We just wanted to get wickets up front, but the way they scored in the 6th over, they were equal to us (powerplay score). I am not a big fan of too many slower balls or variations. You just got to bowl in the right areas. Try to bowl according to the batter and the dimensions. Just wanted to back him (Umran for the final over) and he started the over with two good balls. (Pitch) Bad for bowlers for sure (chuckles). No, really good wicket for the batters. They can come hard and if you put the ball in the right areas you can get wickets as well. Top class innings (from Harry Brook), we needed that type of an innings from him. Having him among the runs is a big plus for us. He can take any team apart, that is why the management sent him to open the batting.",1681495168346,66257
post," We just wanted to get wickets up front, but the way they scored in the 6th over, they were equal to us (powerplay score). I am not a big fan of too many slower balls or variations. You just got to bowl in the right areas. Try to bowl according to the batter and the dimensions. Just wanted to back him (Umran for the final over) and he started the over with two good balls. (Pitch) Bad for bowlers for sure (chuckles). No, really good wicket for the batters. They can come hard and if you put the ball in the right areas you can get wickets as well. Top class innings (from Harry Brook), we needed that type of an innings from him. Having him among the runs is a big plus for us. He can take any team apart, that is why the management sent him to open the batting.",1681495168346,66257
post," Feels good winning away from home. Was always going to be a tight game. With their firepower we knew the total wasn't safe. Our bowlers showed character. I was fortunate that we got off to a great start. Makes life easier. We bat quite deep so you get the freedom. We all know Harry - his ability we have seen. Giving a player like that the time to face a lot of balls. He's Mr. Reliable for sure (Bhuvi). Certainly helps the dressing room. It's a great bunch of guys. It's cricket at the end of the day, always going to teach you a lesson.",1681495415628,66257
post," Feels good winning away from home. Was always going to be a tight game. With their firepower we knew the total wasn't safe. Our bowlers showed character. I was fortunate that we got off to a great start. Makes life easier. We bat quite deep so you get the freedom. We all know Harry - his ability we have seen. Giving a player like that the time to face a lot of balls. He's Mr. Reliable for sure (Bhuvi). Certainly helps the dressing room. It's a great bunch of guys. It's cricket at the end of the day, always going to teach you a lesson.",1681495415628,66257
post, Was a special night. Thankfully we got over the line as well. Got a little tense in the middle. A lot of people say that opening the batting in T20 is the best time to bat. I'm happy to bat anywhere. I've had a lot of success batting at five. Made my name there. My four Test hundreds will have to be over this one. The crowd was phenomenal tonight. I enjoyed it. I was putting pressure on myself a little bit. You go on social media and people are calling you rubbish. There's a lot of Indian fans out there who'll say well done tonight. But they were slagging me off a few days ago. Glad I could shut them up to be honest.,1681495582962,66257
post, Was a special night. Thankfully we got over the line as well. Got a little tense in the middle. A lot of people say that opening the batting in T20 is the best time to bat. I'm happy to bat anywhere. I've had a lot of success batting at five. Made my name there. My four Test hundreds will have to be over this one. The crowd was phenomenal tonight. I enjoyed it. I was putting pressure on myself a little bit. You go on social media and people are calling you rubbish. There's a lot of Indian fans out there who'll say well done tonight. But they were slagging me off a few days ago. Glad I could shut them up to be honest.,1681495582962,66257
post,"Phew, we've had another cracking game! It saw 433 runs scored overall, a hundred from Harry Brook after three failures to start, a superb innings from Markram who took the spinners on when Brook was unable to, and then two blazing fifties from Nitish Rana and Rinku Singh to keep KKR in the hunt chasing 229. But it was probably Bhuvneshwar Kumar and Mayank Markande who made the difference with the ball. So that's a wrap from us here as SRH bounce back after their poor start to the season to win two in a row. Hope you enjoyed our coverage. This is Sagar Chawla signing off on behalf of Praveen, MS Ramakrishnan and Saurabh Shankar. Goodbye!",1681495779657,66257
post,"Phew, we've had another cracking game! It saw 433 runs scored overall, a hundred from Harry Brook after three failures to start, a superb innings from Markram who took the spinners on when Brook was unable to, and then two blazing fifties from Nitish Rana and Rinku Singh to keep KKR in the hunt chasing 229. But it was probably Bhuvneshwar Kumar and Mayank Markande who made the difference with the ball. So that's a wrap from us here as SRH bounce back after their poor start to the season to win two in a row. Hope you enjoyed our coverage. This is Sagar Chawla signing off on behalf of Praveen, MS Ramakrishnan and Saurabh Shankar. Goodbye!",1681495779657,66257
