over_number,commentary_data,timestamp,match_id
15.2," Suyash Sharma to Abhishek Sharma, 1 run, googly, Abhishek lofts the drive to long-off ",1681485409505,66257
15.3," Suyash Sharma to Harry Brook, , that could have been another caught and bowled, but Suyash Sharma thought I am not risking losing my fingers. Powered hard down the ground off the back foot, ump got out of sight quickly, bowler stood unmoved ",1681485447807,66257
15.4," Suyash Sharma to Harry Brook, 1 run, googly, Brook punches it to long-on ",1681485480588,66257
15.5," Suyash Sharma to Abhishek Sharma, , sliced away nicely, beats backward point, tease for the fielder in the deep and he loses despite the dive ",1681485516457,66257
15.6," Suyash Sharma to Abhishek Sharma, , googly, Abhishek advances and lofts the drive over extra-cover. Picked that out of the hands and easily hit that. 15-run over. SRH on course for 210+ ",1681485552849,66257
15.6,,1681485612061,66257
16.1," Narine to Harry Brook, 1 run, short delivery, keeps low, Brook pulls and hits it on the bounce to long-on ",1681485617089,66257
16.1," Harry Brook is looking ominous now! Beware KKR bowlers, beware! Looking set for a maiden IPL century.",1681485617090,66257
16.2," Narine to Abhishek Sharma, , short and wide, cut away past backward point and that bad ball has been punished ",1681485648686,66257
16.3," Narine to Abhishek Sharma, no run, quicker delivery, Abhishek slices it to point ",1681485683198,66257
16.3," Narine to Abhishek Sharma, no run, quicker delivery, Abhishek slices it to point ",1681485683198,66257
16.4," Narine to Abhishek Sharma, 1 run, driven to long-on ",1681485703706,66257
16.5," Narine to Harry Brook, 1 run, dragged to long-on carefully ",1681485729171,66257
16.6," Narine to Abhishek Sharma, , fired wide ",1681485751154,66257
16.6," Narine to Abhishek Sharma, , goes full and straight for the first time to Abhishek in this over and it's a lofted drive way over long-on. What a finish, spoils Narine's figures a bit ",1681485770958,66257
16.6,,1681485847454,66257
17.1," Chakaravarthy to Harry Brook, 1 run, quicker delivery, Harry knocks it to long-on ",1681485862192,66257
17.2," Chakaravarthy to Abhishek Sharma, 1 run, quicker delivery, Abhishek pulls to deep mid-wicket ",1681485895856,66257
17.3," Chakaravarthy to Harry Brook, 1 run, shortish delivery, Brook works it to long-on. Thinks of two, decides against it ",1681485935881,66257
17.4," Chakaravarthy to Abhishek Sharma, , slot ball, at pace, front leg out of the way and baang, over long-on. Clean swing of the bat from Abhishek ",1681485965867,66257
17.5," Chakaravarthy to Abhishek Sharma, 1 run, advances but Chakaravarthy cramps him for room, flicked towards deep mid-wicket ",1681486001193,66257
17.6," Chakaravarthy to Harry Brook, , I am afraid he will hit me down the ground, so let me not offer anything in the slot kind of ball from Chakaravarthy, but he drops it way too short for Brook to have an easy pull shot through square leg, splitting the fielders in the deep. Into the 90s. Enough time for a hundred now ",1681486025547,66257
17.6," Despite that 14-run over , Narine finishes conceding only 28 off his 4 overs...!! Demonstrates his class...!!",1681486025548,66257
17.6,,1681486124192,66257
18.1," Russell to Abhishek Sharma, , way outside off stump ",1681486143990,66257
18.1, Very weird captaincy from Nitish Rana. Not giving Shardul a single over and after that monstrous over of Lockie throwing in the inexperienced Suyash instead of narine or chakravarthy,1681486143991,66257
18.1," Russell to Abhishek Sharma,  Caught!! ",1681486184055,66257
18.1," Russell to Abhishek Sharma,  Caught by Thakur!! In the airrrr, taken at long-on. Oh hang on, Russell is down on the ground in pain. Looks like cramps. Short of a length delivery, Abhishek looks to loft, toe-ends it high and Shardul judges it nicely this time. Hope it's nothing serious with Dre Russ.  ",1681486188339,66257
18.1,"Russell getting help. Oh dear, ! This is why they were not bowling him. Been very injury prone and had to be protected for the last few seasons. Hope this is only cramps. Kolkata had sizzling hot temps today. Anukul Roy on as sub. Shardul will finish the over",1681486194339,66257
18.1,,1681486244985,66257
18.1,,1681486383671,66257
18.2," Thakur to Klaasen, 1 run, short of length delivery on the leg stump, Klaasen works it to long-on ",1681486402617,66257
18.2," Thakur to Klaasen, 1 run, short of length delivery on the leg stump, Klaasen works it to long-on ",1681486402617,66257
18.2,Washi ready to come in as impact sub,1681486408617,66257
18.3," Thakur to Harry Brook, , this is outstanding batting! Not a bad ball at all. Round the wicket yorker, Brook makes room and opens the bat face nicely to split point and cover-point. Top shot from Brook ",1681486469470,66257
18.4," Thakur to Harry Brook, 1 run, advances and looks to drive, toe-ends it to deep cover ",1681486520072,66257
18.5," Thakur to Klaasen, , top edge and over the keeper. Short of a length delivery, Klaasen slogs, gets a thick edge and gets four more for SRH. Can't do much about this as a bowler ",1681486568395,66257
18.6," Thakur to Klaasen, , low full toss, Klaasen flicks, tease for deep deep square leg, he runs and stretches his hand, loses the race ",1681486606635,66257
18.6, Harry Brook will be licking his lips when he visits M. Chinnaswamy in this form !!!!,1681486606636,66257
18.6,Brook will be thinking minimum 15 runs this over,1681486609635,66257
18.6,,1681486675968,66257
19.1," Umesh Yadav to Harry Brook, 2 runs, in the airrr, oh mishit and it lands in front of deep mid-wicket. Looks like today is Harry Brook's day. Nothing is going to stop him. What a shame it would have been had he not got that deserved hundred. Pace off from Umesh Yadav, toe-ended high and he escapes ",1681486714268,66257
19.2," Umesh Yadav to Harry Brook, 2 runs, hit wide of long-on, call for two and Klaasen races back. Brook struggles to get back as he is tired.  ",1681486749324,66257
19.3,"Umesh Yadav to Harry Brook, 1 run, slapped to long-on and that is a  hundred. Tests, ODIs, T20Is, IPL. Put him anywhere he will score! What a talent. He gets the first hundred of the season for us. Slower delivery, hit down the ground, call for two but there was no second. SRH dugout absolutely happy. Even the Eden Gardens crowd applauds. Takes the helmet off, soaks up the applause",1681486788999,66257
19.4," Umesh Yadav to Klaasen, no run, slower delivery outside off stump, Klaasen swings and misses ",1681486832864,66257
19.5," Umesh Yadav to Klaasen, , full toss, Klaasen hits down the ground, wasn't middled but he manages to hit over the rope ",1681486868086,66257
19.6," Umesh Yadav to Klaasen, , short and wide ",1681486906332,66257
19.6," Umesh Yadav to Klaasen, 1 run, short delivery, Klaasen toe-ends the pull, just one run ",1681486941950,66257
19.6," 228/4 after being asked to bat. Dew or no, SRH will take this happily. Harry Brook! They played him in the middle order and he wasn't connecting really well. He had a poor run this far playing on pitches that weren't really batter friendly, but he saw a belter of a wicket here, small boundaries too and pounced on it. KKR came with some really poor new ball bowling. But spin brought them back as Brook shut shop. Dre Russ, who hadn't bowl thus far this season, came on and struck first ball and last ball of his first over. With Brook taking a defensive approach to spin, Markram took the onus to attack and he attacked like a boss. Outscored Brook for his fifty despite the start the English youngster got. That innings was key to Brook playing through. And once pace was on in the form of Ferguson, Brook upped his gears and it didn't matter who bowled at the end as he got his hundred. The shots he played looked effortless, the ball sure flew quite a distance and some of them were absolute gold",1681486944950,66257
19.6,"Pitch, dew, whatever you could say, 229 is really difficult and KKR got to do a miracle against this high quality line up that SRH has. Back in 15 for the chase.",1681486947950,66257
19.6," I’ve had a bit of trouble with spin, but I wanted to use the powerplay to my advantage. So middle overs wanted to rotate strike and let the other boys do the hitting. It is a belter of a pitch, we need to bowl our lengths rightly and take wickets. We still got a job to do. My girlfriend is here but the rest of my family have just left, I’m sure they’ll all be very happy for me.",1681486950950,66257
19.6,,1681486950960,66257
19.6,"Washi comes on as impact sub for Brook. Meanwhile, Venky Iyer is padded up for KKR. It's humid, watchout for Bhuvi's swing!",1681486953950,66257
19.6,,1681487911356,66257
19.6,,1681487911356,66257
0.1," Bhuvneshwar to Gurbaz, no run, Gurbaz walks down the pitch to negate swing, defended ",1681487920440,66257
0.1,One slip in place!,1681487923440,66257
0.2," Bhuvneshwar to Gurbaz, no run, swinging away outside off stump, Gurbaz lets it go ",1681487941882,66257
0.2," Bhuvneshwar to Gurbaz,  Caught!! ",1681487981420,66257
0.3," Bhuvneshwar to Gurbaz,  Caught by Umran Malik!! Hack, a proper hack and he gets an outside edge to third man. Inswinger from Bhuvneshwar. Gurbaz got tricked into a playing across the line slightly, maybe he should have just lofted that over cover. Almost a leading edge that because he swun across the, thick edge and Umran tracks it down nicely for a comfortable catch at third man. Not the start KKR wanted.  ",1681487985368,66257
0.3,Venky Iyer in as sub,1681487988368,66257
0.3,,1681488076227,66257
0.3,,1681488076227,66257
0.4," Bhuvneshwar to Venkatesh Iyer, no run, short of length delivery outside off stump, Venkatesh defends off the back foot ",1681488093596,66257
0.5," Bhuvneshwar to Venkatesh Iyer, leg byes, 1 run, ohh almost troubled him with a big inswinger, if only it was on target. Venkatesh crouched to play that and it made it really tough for him to connect the flick, off the thigh pad ",1681488136407,66257
0.6," Bhuvneshwar to N Jagadeesan, no run, Jagadeesan advances to kill some swing, taps this inswinger to mid-on. Bhuvi, when he gets swing, bowls a pretty good first over usually and starts with a maiden today ",1681488168386,66257
0.6,,1681488222643,66257
1.1," Marco Jansen to Venkatesh Iyer, no run, crunchy cover drive, straight to the fielder ",1681488227679,66257
1.2," Marco Jansen to Venkatesh Iyer, no run, again Iyer is troubled by the incoming angle, somehow manages to toe-end this defence as Marco Jansen targets LBW ",1681488257819,66257
1.3," Marco Jansen to Venkatesh Iyer, 1 run, no problems working this good length delivery away through backward square leg ",1681488290607,66257
1.4," Marco Jansen to N Jagadeesan, no run, short of length delivery outside off stump, Jagadeesan pushes to cover-point ",1681488337525,66257
1.5," Marco Jansen to N Jagadeesan, 1 run, Jagadeesan mistimes the slog to mid-wicket ",1681488372911,66257
1.5,Pressure building on KKR,1681488375911,66257
1.6," Marco Jansen to Venkatesh Iyer, , ah missed a leg-side ball, Venky wanted to hit that to the fine leg fence ",1681488414585,66257
1.6," Marco Jansen to Venkatesh Iyer, no run, just a blind lofted shot. Full and outside off stump, outswing beating Venky on that occasion ",1681488445991,66257
2.1," Bhuvneshwar to N Jagadeesan, , in the airrrr, just out of Tripathi's dive at backward point.Good length delivery, Jagadeesan outside edges the drive, Tripathi full length to the right but it just escaped him ",1681488500369,66257
2.2," Bhuvneshwar to N Jagadeesan, 2 runs, advances and knocks it off the inside edge to mid-wicket ",1681488549912,66257
2.2, Gurbaz is good player but Roy was chasing 240 in PSL and  he has been in very good form KKR should have played him...,1681488549913,66257
2.3," Bhuvneshwar to N Jagadeesan, 1 run, . Good length delivery outside off stump, Jagadeesan hits it straight back to the bowler, Bhuvneshwar wasn't expecting and he didn't have enough time to be honest ",1681488580445,66257
2.4," Bhuvneshwar to Venkatesh Iyer, , mishit, but Venky will take it. Looked like the slower ball, the knuckle ball, yes! Venky goes for the loft and plays a tad early, luckily the timing was good enough to clear mid-off ",1681488643335,66257
2.5," Bhuvneshwar to Venkatesh Iyer, no run, . Now runs at the bowler and has a big swing, totally misses ",1681488674860,66257
2.6," Bhuvneshwar to Venkatesh Iyer, 1 run, short of length delivery, Venkatesh cramped for room, played to mid-off ",1681488709744,66257
3.1," Marco Jansen to Venkatesh Iyer, , the first real well timed shot from Venkatesh. Slower delivery, was picked from the hand so Venkatesh delayed the shot to power it nicely over the bowler's head for four ",1681488766043,66257
3.1," Marco Jansen to Venkatesh Iyer, , the first real well timed shot from Venkatesh. Slower delivery, was picked from the hand so Venkatesh delayed the shot to power it nicely over the bowler's head for four ",1681488766043,66257
3.1," Marco Jansen to Venkatesh Iyer,  Caught!! ",1681488825308,66257
3.2," Marco Jansen to Venkatesh Iyer,  Caught by Markram!! Soft dismissal. Hit me ball down leg, Venkatesh checks his flick shot, leading edge high and a dolly for mid-on. So the impact sub not really working for KKR. SRH bossing this game.  ",1681488828623,66257
3.2,,1681488920480,66257
3.2," Marco Jansen to Narine,  Caught!! ",1681488937937,66257
3.3," Marco Jansen to Narine,  Caught by Markram!! This is such smart bowling from Marco Jansen. 1. cramp the batters for room. 2. Also don't bowl slot.  now. KKR sent Narine up for some pinch hitting. Narine wants to go down the ground immediately and totally miscues it to mid-on. On a batting beauty to be 20/3 in the 4th over, well, can't be doing that.  ",1681488940692,66257
3.3,,1681488940702,66257
3.3,,1681489021165,66257
3.4," Marco Jansen to Nitish Rana, no run, oh ! Full and swinging away outside off stump, Rana leans forward and drives, misses. So easily could have been the edge and a hat-trick ",1681489037251,66257
3.5," Marco Jansen to Nitish Rana, 1 run, knocked to mid-wicket ",1681489072899,66257
3.6," Marco Jansen to N Jagadeesan, 1 run, short of length delivery outside off stump, Jagadeesan taps it square of the wicket ",1681489115485,66257
3.6,,1681489181537,66257
4.1," T Natarajan to N Jagadeesan, , Jaggi opens up straightaway on arrival of his Tamil Nadu teammate Nattu. Front leg out of the way and slogged to deep mid-wicket, although not properly middled ",1681489189771,66257
4.2," T Natarajan to N Jagadeesan, 1 run, drags this short of length delivery to backward square leg ",1681489226469,66257
4.3," T Natarajan to Nitish Rana, no run, full and outside off stump, Rana drives to mid-on ",1681489264793,66257
4.4," T Natarajan to Nitish Rana, 1 run, full delivery outside off stump, Rana slices the drive to deep point ",1681489297958,66257
4.5," T Natarajan to N Jagadeesan, no run, short delivery angling across, Jagadeesan lets it go ",1681489335542,66257
4.6," T Natarajan to N Jagadeesan, , ah shot! Good length delivery, Jagadeesan goes down the ground and lofts it high over long-on. Jaggi started to middle them better now ",1681489369275,66257
4.6,Umran v Rana. How long before he bowls the short ball?,1681489372275,66257
4.6,,1681489417281,66257
4.6,,1681489417281,66257
5.1," Umran Malik to Nitish Rana, , and he starts off with a first ball bouncer. Short delivery, Nitish pulls, totally rushed on the shot. Very lucky that the top edge cleared short fine leg. Umran will try again ",1681489460444,66257
5.2," Umran Malik to Nitish Rana, , oh, this is interesting! Rana is taking on the short ball. This wasn't all that short, Rana stood tall and smashed the pull, landed right on the cushion. This is getting spicy out there ",1681489507082,66257
5.3," Umran Malik to Nitish Rana, , Rana has decided I am going to try and put the pressure back on Umran knowing he's going to come hard at him. But Umran for some reason ran in and dished out a slot ball, dragged to deep mid-wicket. Rinku is smiling and clapping. Shouts of ""KKR, KKR,"" pick up ",1681489567524,66257
5.4," Umran Malik to Nitish Rana, , four more! Markram surely's got to go and have a word with Umran. Pace is alright, but the length and direction is way too off. Short and wide with no off-side defence in the deep, Rana says thank you very much and smashes the cut shot over cover-point ",1681489617959,66257
5.5," Umran Malik to Nitish Rana, , top edgeeee, where is fine leg? How do you not have a fine leg if you are going to bowl short and this guy bowls quick for the edge to travel anyway! Short again, Rana doesn't stop himself from hacking, gets lucky with the edge as it clears short fine leg ",1681489672163,66257
5.6," Umran Malik to Nitish Rana, , what an outstanding shot! Rana expects short stuff, Umran Malik delivers, Rana stays back and cuts this away over backward point for a brilliant six. 28 off that over and SRH have needlessly got KKR back into the game with this poor over ",1681489787921,66257
5.6,,1681489787931,66257
5.6,,1681489787941,66257
5.6,,1681489819733,66257
6.1," Markande to N Jagadeesan, , sliced away nicely, past short third man and four more. Runs just flowing ",1681489835275,66257
6.1," So happy for jagadeesan , he played good knocks in domestic. finally a youngster from CSK got chance in another team.",1681489835276,66257
6.2," Markande to N Jagadeesan, 1 run, knocked to mid-wicket ",1681489850663,66257
6.3," Markande to Nitish Rana, 1 run, flighted delivery on the stumps, Rana sweeps through backward square leg and the crowd is absolutely electric right now ",1681489891868,66257
6.4," Markande to N Jagadeesan, 2 runs, . What are SRH doing? Tripathi the culprit. Jagadeesan plays the slog-sweep, top edges this to deep mid-wicket. Tripathi runs in, gets both hands and spills it ",1681489923468,66257
6.5," Markande to N Jagadeesan, , oh what a shot! Was on the front foot, had to delay because of extra turn and flight from Markande, Jagadeesan opened the bat face last second, tease for short third man and it beats the dive ",1681489955926,66257
6.6," Markande to N Jagadeesan, no run, quicker delivery, Jagadeesan defends off the back foot. Eden Gardens is loud. You are missing something spectacular tonight if you are not watching this ",1681489996768,66257
6.6,,1681490075884,66257
7.1," Washington Sundar to Nitish Rana, 2 runs, 101kph, full ball sliding into the pads, Rana flicks it gently through midwicket and gets an easy two ",1681490094821,66257
7.1,Washington will bowl from round the wicket to the leftie,1681490098807,66257
7.2," Washington Sundar to Nitish Rana, no run, length ball sliding in towards off, 101.6kph, Rana gets forward and punches to cover ",1681490123214,66257
7.2," Washington Sundar to Nitish Rana, no run, length ball sliding in towards off, 101.6kph, Rana gets forward and punches to cover ",1681490123214,66257
7.3," Washington Sundar to Nitish Rana, 1 run, 98kph, full ball fired in on middle and leg, Rana knocks it to long-on ",1681490143477,66257
7.3," Rahman - Gurbaz is the only specialist WK in KKR, right?
-- Jagadeesan can also keep wickets.",1681490143478,66257
7.4," Washington Sundar to N Jagadeesan, , 102.8kph, length ball sliding away outside off as Washington stays round the wicket to Jagadeesan as well. This isn't all that short. But Jagadeesan backs away, makes room and slaps it through backward point ",1681490186211,66257
7.5," Washington Sundar to N Jagadeesan, no run, Washington continues firing them in. Close to 101kph, length ball darted across off. Jagadeesan tries using the pace to dab it fine, but he's beaten ",1681490222158,66257
7.6," Washington Sundar to N Jagadeesan, 1 run, length ball sliding away outside off, Jagadeesan slaps it through cover, only a single ",1681490249659,66257
8.1," Markande to N Jagadeesan, no run, Jagadeesan advances but he's nowhere close to the pitch of this legbreak. Pushes it back to Markande ",1681490307088,66257
8.1," Markande to N Jagadeesan,  Caught!! ",1681490332518,66257
8.2,"Markande to N Jagadeesan,  Caught by (sub)Glenn Phillips!! There's some air on this leg-break, and Jagadeesan's eyes light up. He gets down low, hits the slog-sweep and holes out at deep midwicket! Struck it quite well, but just didn't get much elevation. It goes flat to the left of Phillips, the sub fielder, at deep midwicket. And he judges it well. Markande, who should've had him in his first over, gets him eventually. ",1681490336809,66257
8.2," Despite having Dale Steyn as your bowling coach, Umran hasn't really matured as a bowler. Another evidence that only a perfect line and length ball can get you wickets but not sheer pace.",1681490336810,66257
8.2,Timeout!,1681490339809,66257
8.2,Slip in place for Russell. He's scored just one run in his last two innings.,1681490342809,66257
8.2,,1681490534221,66257
8.3," Markande to Russell, 1 run, googly on middle and leg, Russell hangs back and tucks it gently behind square ",1681490556410,66257
8.4," Markande to Nitish Rana, 1 run, 95kph, length ball turning in from just outside off, Rana clips it through midwicket ",1681490586215,66257
8.5," Markande to Russell, no run, well flighted legbreak around off, Russell gets forward and defends ",1681490610779,66257
8.6," Markande to Russell, no run, flat length ball sliding through on middle, Russell hangs back and blocks ",1681490628902,66257
8.6,,1681490698404,66257
9.1," Marco Jansen to Nitish Rana, no run, 135.2kph, good length delivery just outside off, Rana gets forward and defends to cover ",1681490704118,66257
9.2," Marco Jansen to Nitish Rana, 1 run, short of length on off, Jansen takes pace off and Rana tucks it behind square on the on-side ",1681490737638,66257
9.3," Marco Jansen to Russell, 1 run, big heave from Russell! Short of length into the body, he looks to muscle it out of the city but mistimes it along the ground to deep square leg ",1681490790395,66257
9.3, Finally DreRus gets some good amount of overs to bat but on a wrong day when RRR is already 14 in 9th over,1681490827052,66257
9.4," Marco Jansen to Nitish Rana, , leg byes, 1 run, 143kph, full ball slanted down leg, Rana looks to flick it away but is hit on the pad. The hooter goes off to signal that Jansen has overstepped ",1681490874524,66257
9.4," Marco Jansen to Nitish Rana, , leg byes, 1 run, 143kph, full ball slanted down leg, Rana looks to flick it away but is hit on the pad. The hooter goes off to signal that Jansen has overstepped ",1681490874524,66257
9.4," Marco Jansen to Russell, 1 run, excellent delivery! 136.9kph, speared in close to the blockhole, and Russell drags it off a thick inside edge onto pad as he looks to slog ",1681490903888,66257
9.5," Marco Jansen to Nitish Rana, no run, sharp short ball at 139.4kph! It flies over Rana's left shoulder and he opts to evade, rather than take it on ",1681490935756,66257
9.6," Marco Jansen to Nitish Rana, , now this one's too high! Another bouncer, and it sails over Rana's head ",1681490972577,66257
9.6," Marco Jansen to Nitish Rana, ,  137kph, length ball around off, and Rana nails the cross-batted swipe over long-on ",1681491006637,66257
9.6," Markande to Russell,  Caught!! ",1681491077420,66257
10.1," Markande to Russell,  Caught by Marco Jansen!! Again Russell falls early to a legspinner.  Flat legbreak around leg, Russell wants to swing it down the ground but the length isn't in his half. The ball grips and holds, Russell skies it up, goes many a mile in the air, and Jansen takes such a composed catch coming in from long-on.  ",1681491081318,66257
10.1,,1681491081328,66257
10.1,Rinku Singh walks out to a big ovation,1681491084318,66257
10.1,,1681491142625,66257
10.2," Markande to Rinku Singh, 1 run, floated up outside off, quite full, and Rinku drives to long-off ",1681491177876,66257
10.3," Markande to Nitish Rana, no run, googly turning away off a length outside off, Rana looks to open the face and knock it through the off-side, but he's beaten by the turn! Not sure if he picked it ",1681491200385,66257
10.4," Markande to Nitish Rana, no run,  Lovely bowling from Markande! Tosses it up around off, Rana gets forward to defend but it spins past the edge ",1681491219306,66257
10.5," Markande to Nitish Rana, 1 run, knocks this googly into the off-side for one ",1681491244642,66257
10.6," Markande to Rinku Singh, 1 run, length ball outside off, Rinku uses his wrists nicely to clip it through midwicket ",1681491272153,66257
10.6,,1681491319892,66257
11.1," Washington Sundar to Rinku Singh, 1 run, 98.2kph, length ball sliding into the pads, Rinku looks to clip it away but it goes off an inside edge to short fine ",1681491335224,66257
11.2," Washington Sundar to Nitish Rana, , right in the slot for Rana! 100.2kph, fired in full around off, Rana gets forward and hammers it straight back ",1681491358249,66257
11.3," Washington Sundar to Nitish Rana, 2 runs, 101.3kph, full delivery drifting into off, Rana gets forward and pushes through extra cover for two!  ",1681491389098,66257
11.4," Washington Sundar to Nitish Rana, 1 run, goes for a slog-sweep but mistimes it through midwicket ",1681491413973,66257
11.4," Washington Sundar to Nitish Rana, 1 run, goes for a slog-sweep but mistimes it through midwicket ",1681491413973,66257
11.5," Washington Sundar to Rinku Singh, 1 run, 103.7kph, flat length ball outside off, Rinku cuts it through point ",1681491439114,66257
11.6," Washington Sundar to Nitish Rana, 1 run, 103.4kph, full delivery just outside off, Rana gets low and sweeps to deep backward square ",1681491462661,66257
12.1," Markande to Nitish Rana, 2 runs, googly on off, Rana tries a reverse-sweep and manages to get it quite fine. Chase for short third man who does well to cut it off ",1681491526349,66257
