over_number,commentary_data,timestamp,match_id
14.4," Harshal Patel to Tim David, no run, back of a length outside off, Tim David gets forward and punches firmly, but extra-cover gets across and cuts it off to his left. Saved two at least. Suyash the sub there ",1680448865997,66190
14.5," Harshal Patel to Tim David, 1 run, short outside off, Tim David mistimes the pull to deep square leg ",1680448914216,66190
14.6," Harshal Patel to Tilak Varma, no run, good pacy short ball, dug in and flies past Tilak Varma who barely had time to react as he went for the pull ",1680448952687,66190
14.6,,1680448952697,66190
14.6,,1680448952697,66190
14.6,! RCB need to ensure they don't let MI away in these last 5 overs. We all know what Tim David can do and Tilak Varma is looking really good too. But one wicket and there's not much batting left for MI.,1680448955687,66190
15.1," Karn Sharma to Tim David, 1 run, flat and pushed through on a length just outside off, Tim David forces it off the back foot to deep cover ",1680449159610,66190
15.2," Karn Sharma to Tilak Varma, 1 run, tossed up very full outside the leg-stump, flicked to deep mid-wicket and the call was for two from Tilak Varma but Tim David with a loud shout of ""no"" ",1680449197088,66190
15.2,,1680449200088,66190
15.3," Karn Sharma to Tim David, , slower and wider outside off, turns away, left alone and the wide taken ",1680449221742,66190
15.3," Karn Sharma to Tim David,  Bowled!! ",1680449239904,66190
15.3," Karn Sharma to Tim David,  Bowled!! Karn Sharma punches the air in delight. Drifts into middle and leg, turns away after pitching, Tim David aims for a big slogsweep and misses, the stumps are messed up. Big wicket that. Now RCB can pile on the pressure.  ",1680449241495,66190
15.3,,1680449332099,66190
15.4," Karn Sharma to Hrithik Shokeen, 1 run, good length legbreak on off and middle, tucked to deep backward square leg and Tilak Varma sends Hrithik Shokeen back for the 2nd ",1680449343666,66190
15.5," Karn Sharma to Tilak Varma, 1 run, flat length on the middle and leg line, nudged to deep backward square leg ",1680449376069,66190
15.6," Karn Sharma to Hrithik Shokeen, , poor delivery, short and down leg, Hrithik Shokeen went low and pulls it away to the fine-leg fence, placed it to get a handy boundary ",1680449405159,66190
15.6," Tilak Varma is absolutely phenomenal. The positive approach, the patience, the elegance, the way he's communicating with Nehal and making him familiar with the game on his debut...signs of a great player in the making. Hoping to see more of him this year. One of the best finds of the IPL",1680449405160,66190
15.6,,1680449488116,66190
16.1," Akash Deep to Tilak Varma, ,  A back of a length delivery on the stumps, Tilak Varma slugs it away over deep square leg, nearly into the second tier. Points to the MI crest on his jersey and pumps his fist ",1680449496832,66190
16.2," Akash Deep to Tilak Varma, no run, good comeback, slower short ball across Tilak Varma who slashes and misses ",1680449546946,66190
16.3," Akash Deep to Tilak Varma, no run, very full on the stumps, whipped straight to the fielder at mid-wicket. Another dot ",1680449587499,66190
16.4," Akash Deep to Tilak Varma, no run, Tilak Varma moves across his stumps, but this wide yorker is still further away, left alone and a wide called. But . Clearly wide of the tramline on the off-side - let's see what the third ump decides.  of Tilak as he has moved across with his left foot outside the off-stump. A dot and DK was the man who has to get the credit for that ",1680449741366,66190
16.5," Akash Deep to Tilak Varma, , slower short ball at Tilak Varma who pulls and the top-edge flies away to the fine-leg fence ",1680449755851,66190
16.6," Akash Deep to Tilak Varma, 2 runs, a low full-toss on the stumps, Tilak Varma is early into the flick, the thick leading-edge falls in front of long-on and they come back for two ",1680449808333,66190
16.6,,1680449893197,66190
16.6,,1680449893197,66190
16.6," Harshal Patel to Hrithik Shokeen,  Caught!! ",1680449914356,66190
17.1," Harshal Patel to Hrithik Shokeen,  Caught by du Plessis!! Superb catch by Faf at mid-off. Full outside off, Hrithik Shokeen gets forward and actually lofts well, but Faf anticipated it well and moved back to take it over his shoulder as he cups it with two hands and tumbles to ground. Made it simple due to his athletic ability.  ",1680449918150,66190
17.1,,1680450010464,66190
17.2," Harshal Patel to Arshad Khan, 1 run, the slower ball is a low full-toss on the stumps, heaved to deep mid-wicket ",1680450025183,66190
17.3," Harshal Patel to Tilak Varma, , this is a wide outside off, left alone and DK can't stop it. Karn Sharma at short third man had he hit direct, could have got Arshad Khan. Was a close shave ",1680450075139,66190
17.3," Harshal Patel to Arshad Khan, 2 runs, another low full-toss outside off, swung away wide of Kohli at long-on who gets across and cuts it off with a dive, gets up and fires in a precise throw on the bounce to DK, but can't prevent the 2nd ",1680450100810,66190
17.4," Harshal Patel to Arshad Khan, 1 run, back of a length on the stumps, Arshad Khan according to the ump got an inside-edge onto the thigh, they run a quick single as the ball stays on the pitch ",1680450150949,66190
17.5," Harshal Patel to Tilak Varma, no run, a fine off-cutter slower ball, dips and drops on Tilak Varma who gets forward to drive and is beaten, just wide of off-stump ",1680450174622,66190
17.6," Harshal Patel to Tilak Varma, ,  length delivery and width outside off, bad ball, Tilak Varma scythes it hard and to the sweeper cover fence. Faf has a word with Harshal Patel after that ",1680450210656,66190
17.6,,1680450264234,66190
17.6, Wide ball review. One of the stupidest decisions by IPL yet. I am certain they will eventually do away with on field umpires. All decisions will be delivered by TV umpire. You read it here first!,1680450264235,66190
18.1," Siraj to Arshad Khan, no run, pacy back of a length delivery outside off, zips past Arshad Khan who pulls and misses, flies past off-stump ",1680450304471,66190
18.1,Tilak Varma walks up to Arshad Khan to have a word. Strike should be Tilak Varma's for MI's benefit,1680450307471,66190
18.2," Siraj to Arshad Khan, 1 run, full outside off, Arshad Khan drives to deep point and turns the strike over ",1680450339722,66190
18.3," Siraj to Tilak Varma, , short and wide outside off, Tilak Varma reaches for it to slash and misses, wide called. Was wide too ",1680450395516,66190
18.3,"Fine-leg, long-on, deep square leg and two men at deep point are the 5 men out.",1680450398516,66190
18.3," Siraj to Tilak Varma, , another wide. Siraj gets this wide line outside off way wrong ",1680450426923,66190
18.3," Siraj to Tilak Varma, , hat-trick of wides. Dug in short outside off, too short and Tilak Varma misses the slash ",1680450466964,66190
18.3,Faf with a smile wants to have a word with Siraj,1680450469964,66190
18.3," Siraj to Tilak Varma, , way outside off and that's four in a row ",1680450506021,66190
18.3," Siraj to Tilak Varma, , way outside off and that's four in a row ",1680450506021,66190
18.3,Such poor game-sense from Siraj. He is unnecessarily putting pressure on his team,1680450509021,66190
18.3," Siraj to Tilak Varma, 2 runs, fullish just outside off, Tilak Varma heaves wide of Kohli at long-on and comes back for the second ",1680450544578,66190
18.4," Siraj to Tilak Varma, , nice. Mid-off was up and Tilak Varma comes down the track, gets outside the leg-stump and lofts the length delivery with a straight bat wide of mid-off ",1680450591187,66190
18.5," Siraj to Tilak Varma, , back to wides. The wide outside off line misses its radar again ",1680450630451,66190
18.5,Faf can just have a wry smile at the moment. A change in field. Mid-wicket goes back,1680450633451,66190
18.5," Siraj to Tilak Varma, , Tilak Varma is turning it on. Deep square leg was in, this is a length delivery on the stumps, dragged wide of that man and into the gap, was more of a thick inside-edge ",1680450675675,66190
18.6," Siraj to Tilak Varma, no run, finally gets one right. Full and inside the tramline on the off-side, Tilak Varma reaches for it and can't lay bat on ball on the drive ",1680450729912,66190
19.1," Harshal Patel to Arshad Khan, 2 runs, full on the pads, flicked away wide of deep mid-wicket and they take two. 150 comes up ",1680450800527,66190
19.2," Harshal Patel to Arshad Khan, , Arshad Khan can strike them. He stands back and hammers the back of a length delivery just outside off flat over deep mid-wicket. A powerful biff that one. Even Faf is left with his mouth open ""ooohing"" in admiration ",1680450831854,66190
19.3," Harshal Patel to Arshad Khan, 1 run, a low full-toss outside off, Arshad Khan drags it to long-on and gives Tilak Varma the strike ",1680450881385,66190
19.4," Harshal Patel to Tilak Varma, , slower short ball at Tilak Varma who does well to control the pull, places it through square leg and beats Bracewell to his right from deep backward square leg ",1680450919610,66190
19.5," Harshal Patel to Tilak Varma, , 1 run, over the waist no-ball as the full-toss slips out, Tilak Varma is surprised and can only find cover.  - but will lose it, as it is over the waist and clearly over ",1680450959777,66190
19.5," Harshal Patel to Arshad Khan, 1 run, another low full-toss on the stumps, Arshad Khan only find deep mid-wicket with a flick. Was another ball begging to be hit ",1680451062635,66190
19.6," Harshal Patel to Tilak Varma, , Tilak Varma ends on a high. The slower ball full on the stumps, Tilak Varma gets forward and helicopters the flick, just clears long-on and that is a fine end to MI's innings ",1680451103861,66190
19.6," Tilak Varma punches the air as he runs off. What a knock it has been from him. MI looked down and out at 20-3 and when SKY got out at 48-4 but Tilak has stood tall and single-handedly almost steered his side over 170. It may still not be enough but Tilak has shown his temperament and skill tonight. Failures for MI's big guns and good bowling from Karn Sharma and Michael Bracewell in the middle put pressure on MI but the last 4 overs have produced 60 and turned the momentum around. Handy cameos from Nehal Wadhera and Arshad Khan but it is Tilak who stole the show. RCB will be disappointed to have let things slip away, but they know with their batting, they can chase this down. Back for the chase shortly...",1680451106861,66190
19.6,,1680451106871,66190
19.6,,1680451106881,66190
19.6," My plan was to adjust to the wicket and see how it was doing. It was holding a bit. So, I took my time initially and then see how it goes. My mindset was positive and I was constantly talking to my partners and asking them what a good score would be. The ball from the spinners were holding up a bit. So, they were a little tough as compared to the pacers. I was thinking that he can bowl wide yorkers. He was under pressure. I was just backing myself to punish him if he missed, so he was under pressure there.",1680451109861,66190
19.6,"Welcome back. MI in a huddle. Out walk Kohli and Faf. . Can the Aussie get it to swing? If he does, he will be a threat. Kohli is standing outside his crease. A slip in for the pacer.",1680451112861,66190
19.6,,1680452097274,66190
19.6,,1680452097274,66190
0.1," Behrendorff to Kohli, 1 run, Kohli is off the mark, good length on off, he gets forward and defends wide of backward point who dives to his left but can't stop it ",1680452106895,66190
0.2," Behrendorff to du Plessis, no run, good length and straight, on middle-stump, defended to backward point ",1680452126953,66190
0.2,So far no swing for Behrendorff,1680452129953,66190
0.3," Behrendorff to du Plessis, 1 run, full on the stumps, du Plessis' bottom-hand takes over and he drives it wide of mid-off for one ",1680452159644,66190
0.3,"Shouts of ""Kohli, Kohli"" ring around the Chinnaswamy",1680452162644,66190
0.4," Behrendorff to Kohli, 1 run, Kohli gets forward and is down the track, defends the length delivery wide of cover for a quick single ",1680452192490,66190
0.4," Behrendorff to Kohli, 1 run, Kohli gets forward and is down the track, defends the length delivery wide of cover for a quick single ",1680452192490,66190
0.5," Behrendorff to du Plessis, 2 runs, back of a length on the stumps, turned to fine-leg and Faf comes back for the 2nd ",1680452226636,66190
0.5,SKY's night is done - he is relaxing and passing on some tips to a youngster seated next to him in the dugout.,1680452229636,66190
0.6," Behrendorff to du Plessis, no run, good length and tight on the stumps, du Plessis with a forward defence ",1680452257189,66190
0.6, Jofra vs Kohli will be a mouthwatering contest!!,1680452257190,66190
0.6,,1680452326868,66190
1.1," Arshad Khan to Kohli, , swing for Arshad Khan but starts down leg and goes further, Kohli flicks and misses ",1680452330620,66190
1.1," Arshad Khan to Kohli, , and again, the length is shortened but the line is down leg, Kohli flicks and misses ",1680452355414,66190
1.1," Arshad Khan to Kohli, , hat-trick of wides down leg, Kohli flicks and misses ",1680452387514,66190
1.1," Arshad Khan to Kohli, no run, , full and gets the radar right, inswing for Arshad Khan, Kohli gets forward to drive and the inside-edge strikes the back thigh and rolls near his feet ",1680452419531,66190
1.2," Arshad Khan to Kohli, , too straight and that's into Kohli's strength, full inswinger on middle-stump, flicked wide of short fine-leg, who dives to his left but cant' get there ",1680452458540,66190
1.3," Arshad Khan to Kohli, no run, fullish outside off, Kohli charges Arshad Khan and mistimes the drive to cover ",1680452493845,66190
1.4," Arshad Khan to Kohli, 1 run, full on the pads, flicked away wristily to deep backward square leg ",1680452531010,66190
1.5," Arshad Khan to du Plessis, leg byes, 1 run, lovely inswinging yorker that has du Plessis on the floor, swings in wickedly as du Plessis flicks and misses, impact is outside the leg-stump though ",1680452572866,66190
1.6," Arshad Khan to Kohli, no run, Kohli uses his feet and drills the full delivery straight to the fielder at mid-on, timed it well but did not find the gap ",1680452604179,66190
2.1," Behrendorff to du Plessis, , all timing. du Plessis comes down the track and meets the length delivery on the rise, timed the cover drive past the off-side field ",1680452651686,66190
2.2," Behrendorff to du Plessis, no run, . A short of length delivery that nips back in ever so slightly, du Plessis was looking to dab that and misses, just wide of off-stump ",1680452685616,66190
2.3," Behrendorff to du Plessis, , du Plessis has been in fine nick in all the T20 leagues around the world recently. Gives Behrendorff the charge and flicks the length delivery over mid-wicket, all the way ",1680452719559,66190
2.4,"Behrendorff to du Plessis, , another one. A slower ball on a fuller length outside off, in the slot, du Plessis stays back and hammers it over long-off. Another clean strike",1680452759866,66190
2.4,I0$,1680452762866,66190
2.5," Behrendorff to du Plessis, no run, pitches outside the leg-stump, cramps du Plessis for room, he flicks and misses ",1680452812119,66190
2.5," Behrendorff to du Plessis, no run, pitches outside the leg-stump, cramps du Plessis for room, he flicks and misses ",1680452812119,66190
2.6," Behrendorff to du Plessis, no run, with short fine-leg inside, du Plessis goes down on one knee and tries the scoop, misses, wants a leg-side wide but gets nothing ",1680452850644,66190
2.6," suprising impact player choice by MI, SKY is a gun fielder. Playing Behrendroff from the start and getting Piyush only when he was needed to bowl would have made more sense as a fielding unit, right ?",1680452850645,66190
2.6,,1680452911117,66190
3.1," Jofra Archer to Kohli, no run,  A hard length delivery outside off, Kohli makes room and miscues the drive, went to Jofra Archer's left, who did not get down in time to snaffle that. Was not anticipating that. Got hands and dropped it ",1680452921897,66190
3.2," Jofra Archer to Kohli, , back of a length outside off, Kohli stays besides the line of the ball and guides it between backward point and short third man, pure placement that ",1680452962147,66190
3.3," Jofra Archer to Kohli, no run, pacy delivery this. Fires it on a short of length outside off, extra bounce, Kohli tries to slash and misses, flies to Ishan Kishan ",1680452999144,66190
3.4," Jofra Archer to Kohli, no run, hits a hard back of a length on off, Kohli gets forward to defend to cover ",1680453038415,66190
3.5," Jofra Archer to Kohli, , a flat six. Kohli takes on Jofra Archer and sends him over long-off. Was the leg-cutter slower ball outside off and Kohli comes down the track to slam it flat ",1680453076124,66190
3.6," Jofra Archer to Kohli, no run, fullish outside off, Kohli gets forward to drive nicely but cover fields. Good shot for no run ",1680453113860,66190
3.6,,1680453193069,66190
4.1," Chawla to du Plessis, no run, flat and into the pitch on the stumps, du Plessis mistimes the pull to backward square leg ",1680453199620,66190
4.2," Chawla to du Plessis, no run, quicker good length delivery on the middle and leg line, turned to backward square leg ",1680453225910,66190
4.3," Chawla to du Plessis, no run, the attempted googly is quicker outside off, flat-batted cut to cover. Three dots in a row ",1680453251465,66190
4.4," Chawla to du Plessis, , in the gap and wide of the off-side field. A good length delivery outside off, du Plessis cuts and picks the gap at extra-cover ",1680453279740,66190
4.5,"Chawla to du Plessis, no run, good ball and beats du Plessis on the slash, Ishan too fumbles, tossed up googly outside off, does not turn back in enough to hit off-stump. Hang on - , so would have been a wicket",1680453310211,66190
4.6," Chawla to du Plessis, 1 run, the front of the hand dart on off, du Plessis punches to mid-wicket and takes a single ",1680453344718,66190
5.1," Jofra Archer to du Plessis, 1 run, back of a length on off, du Plessis stays besides the line to tap through cover-point ",1680453417518,66190
5.2," Jofra Archer to Kohli, no run, full on off, there's that trademark Kohli check-drive, but mid-off gets across and cuts it off with a dive ",1680453454847,66190
5.3," Jofra Archer to Kohli, , that's Kohli at his very best. Picked up the back of a length delivery outside off so quickly, transferred the weight back but was on the front foot to pull over mid-wicket. Authoritative ",1680453486751,66190
5.4," Jofra Archer to Kohli, 1 run, short of length just outside off, dabbed wide of backward point for an easy single ",1680453524738,66190
5.4," Jofra Archer to Kohli, 1 run, short of length just outside off, dabbed wide of backward point for an easy single ",1680453524738,66190
5.4," Pritam the only logic behind that would be is that except for Rohit and SKY, rest of the MI lineup have got players who can bowl at least 1 over, given that their bowling attack heavily depends on Archer, the skipper would like to have maximum number of options possible at his disposal.",1680453524739,66190
5.4,Faf and Kohli are batting with intent and purpose,1680453524748,66190
5.5," Jofra Archer to du Plessis, 1 run, back of a length and into the pitch, du Plessis is cramped up and his flapping pull just clears square leg going back ",1680453562593,66190
5.6," Jofra Archer to Kohli, 1 run, good length on the stumps, drop and run to mid-on and that's a great powerplay for RCB ",1680453597067,66190
5.6,,1680453597077,66190
6.1," Chawla to Kohli, no run, good length on off, punched and Rohit at cover dives to his right to make a fine stop ",1680453653360,66190
6.2," Chawla to Kohli, 1 run, the attempted googly outside off, dabbed wide of short third man ",1680453692001,66190
6.3," Chawla to du Plessis, 1 run, good length on the stumps, clipped away to deep mid-wicket for one ",1680453723342,66190
6.4," Chawla to Kohli, 1 run, no spin, full on off, Kohli gets forward to drive to long-off ",1680453760300,66190
6.5," Chawla to du Plessis, 1 run, another googly on the stumps, du Plessis punches wide of Chawla ",1680453787648,66190
6.6," Chawla to Kohli, 1 run, fullish on the stumps, Kohli gets forward to defend wide of cover for a quick single ",1680453817677,66190
6.6,,1680453873452,66190
7.1," Green to Kohli, 1 run, back of a length on the stumps, Kohli stays leg-side of the ball and punches wide of backward point for one ",1680453896377,66190
7.2," Green to du Plessis, , superb from du Plessis. Fullish on off, du Plessis gets forward and drives between cover and mid-off, he looks in great nick ",1680453927926,66190
7.3," Green to du Plessis, no run, dug in short on the stumps, du Plessis pulls and misses, du Plessis wants one short ball for the over from Nitin Menon, but gets nothing. du Plessis and Kohli are in splits at that call ",1680453960162,66190
7.4," Green to du Plessis, 2 runs, good length angling into off-stump, heaved away to deep backward square leg, where the fielder does well to prevent the four ",1680454003039,66190
7.5," Green to du Plessis, , poor ball. Green tried the slower off-cutter into the pitch, width was there, slashed over cover ",1680454034451,66190
7.6," Green to du Plessis, , big over this. du Plessis shuffles across nonchalantly and picks the length delivery from the stumps, scoops it all the way over fine-leg - 17 off the over. Audacious batting and MI are in trouble ",1680454119251,66190
8.1," Chawla to Kohli, , tossed up full on the stumps and too full actually, Kohli gets forward and drives straight down the ground and takes four ",1680454199981,66190
8.2," Chawla to Kohli, no run, slower legbreak outside off, Kohli tries to go hard on the cover drive and inside-edges it back to Chawla ",1680454225090,66190
8.2," Chawla to Kohli, no run, slower legbreak outside off, Kohli tries to go hard on the cover drive and inside-edges it back to Chawla ",1680454225090,66190
8.3," Chawla to Kohli, no run, fraction short outside off, cut straight to the fielder at backward point ",1680454251238,66190
8.4," Chawla to Kohli, 1 run, du Plessis did not move till the ball passed Rohit at cover, had Rohit fielded that, du Plessis was in big trouble ",1680454277765,66190
8.5,"Chawla to du Plessis, no run,  Rohit does not take the review. The googly and du Plessis is caught on the back foot as he misses the nudge, impact on leg-stump and easily sliding down",1680454317983,66190
8.6," Chawla to du Plessis, no run, tossed up outside off, spins back in and is inside the line on the off-side, left alone and that's the  as well ",1680454335591,66190
8.6,MI's opening game woes look set to continue. RCB sauntering in this chase. And you can score even 100 here off the last 5 overs if you have a great night. MI need a minor miracle to win this one from here.,1680454338591,66190
8.6,,1680454529909,66190
9.1," Hrithik Shokeen to Kohli, 2 runs, slower offbreak on middle-stump, swung away to deep backward square leg and Tilak does well on the dive to save the four ",1680454547024,66190
9.2," Hrithik Shokeen to Kohli, 1 run, wide of the crease and tossed up on off, Kohli eases it down to long-on ",1680454573353,66190
9.3," Hrithik Shokeen to du Plessis, , that's into du Plessis' range.  A tossed up offbreak on off, he gets forward and slogsweeps over deep mid-wicket, the ball flies away ",1680454597086,66190
9.4," Hrithik Shokeen to du Plessis, , in the slot and the long levers of du Plessis comes into play. Full on the stumps, du Plessis clears his front leg and smashes it over long-on ",1680454635044,66190
9.5," Hrithik Shokeen to du Plessis, 1 run, Hrithik Shokeen shifts to round the wicket, flatter delivery on the stumps, tucked away to deep mid-wicket ",1680454677663,66190
9.6," Hrithik Shokeen to Kohli, 1 run, flat good length on the stumps, tucked away wide of mid-wicket ",1680454701300,66190
10.1," Chawla to Kohli, no run, pushed quicker onto off. Kohli tries a tap and run towards point but the fielder is alert ",1680454751960,66190
10.2," Chawla to Kohli, 2 runs, generously flighted, hammered hard and straight as an arrow - deflects off the non-striker's stumps to the right of long-on ",1680454782062,66190
10.3," Chawla to Kohli, , given some flight again, and this in the arc for Virat Kohli. ",1680454811285,66190
10.4," Chawla to Kohli, 1 run, fuller on off, driven towards long-off ",1680454841565,66190
10.5," Chawla to du Plessis, no run, pitched up, du Plessis strides closer to punch towards extra cover ",1680454869637,66190
10.6," Chawla to du Plessis, 2 runs, flighted and straight, du Plessis inside halves his big slog to the left of deep mid-wicket. Two runs taken ",1680454905941,66190
10.6," Faf's love with IPL continues, one of the most consistent performers over",1680454905942,66190
10.6,,1680454994631,66190
10.6,,1680454994631,66190
11.1," Jofra Archer to Kohli, 2 runs, back of a length onto off, Kohli with a gentle push towards mid-wicket. So quick between the wickets to complete two runs with that stroke. There was a direct hit but Faf was back by then ",1680455043305,66190
11.2," Jofra Archer to Kohli, no run, short onto off, extra bounce. Kohli defends off the splice to the left of the bowler ",1680455086377,66190
11.2, after Chris Gayle and Mayank Agarwal's 113-run stand in the 2011 Qualifier 2 in Chennai.,1680455086387,66190
11.3," Jofra Archer to Kohli, 2 runs, slower delivery that was pitched up, driven towards deep extra for another couple of runs... ",1680455119588,66190
11.4," Jofra Archer to Kohli, no run, short on the body, Kohli ducks under ",1680455149548,66190
11.5," Jofra Archer to Kohli, 1 run, good length and straight, pushed down the ground past Archer for a single.  ",1680455181304,66190
