over_number,commentary_data,timestamp,match_id
11.6," Jofra Archer to du Plessis, no run, slower length ball, cut into the pitch and back to Archer. Du Plessis is vexed he didn't get that ball away ",1680455231234,66190
11.6,,1680455299113,66190
12.1," Behrendorff to Kohli, , banged short onto middle and leg. Kohli reads early and steps out to pull through cow corner. One bounce and into the fence... ",1680455306447,66190
12.1,,1680455306457,66190
12.2," Behrendorff to Kohli, 1 run, yorker length as Kohli charged out again. Thick leading edge on his clip takes the ball towards long-off ",1680455348318,66190
12.3," Behrendorff to du Plessis, , slower bouncer, Du Plessis gauged the length really early, held back in his crease and heaved his pull over deep mid-wicket!! ",1680455390765,66190
12.4," Behrendorff to du Plessis, , full but angling onto the pads from round the wicket. A gentle glance through deep backward square leg by Faf du Plessis. Four more! ",1680455436708,66190
12.5," Behrendorff to du Plessis, no run, yorker on off, stabbed towards the non-striker's stumps and deflects towards Rohit at extra cover ",1680455473166,66190
12.5, Fun Fact: MI Last won their opening match back in 2012. In the same season their Specialist Spinner Piyush Chawla won his team KKR their first Title with a match winning boundary !!,1680455473167,66190
12.6," Behrendorff to du Plessis, 1 run, full on off, du Plessis with an uppish push towards deep cover. Gets to the fielder on the bounce ",1680455509435,66190
13.1," Jofra Archer to du Plessis, 2 runs, good length on off, cut towards sweeper cover for a couple of runs ",1680455589174,66190
13.1,Run a ball needed now,1680455592174,66190
13.2," Jofra Archer to du Plessis, 1 run, slower delivery with a straight line, turned to mid-wicket ",1680455623213,66190
13.3," Jofra Archer to Kohli, , short and tried to test Kohli with the extra pace on the body. The former RCB captain says thank you very much and effortlessly pulls over deep square leg for a sixer!! ",1680455655386,66190
13.3," Jofra Archer to Kohli, , short and tried to test Kohli with the extra pace on the body. The former RCB captain says thank you very much and effortlessly pulls over deep square leg for a sixer!! ",1680455655386,66190
13.4," Jofra Archer to Kohli, 1 run, short again, pulled along the ground towards deep mid-wicket ",1680455693364,66190
13.5," Jofra Archer to du Plessis, no run, full and straight, driven towards mid-off ",1680455721054,66190
13.6," Jofra Archer to du Plessis, no run, short outside off, dabbed towards backward point ",1680455753567,66190
13.6," RCB are cruising, on fourth gear with their feet up. MI need to find a breakthrough - 2 wicket and this soft middle-order can be tested.",1680455756567,66190
13.6,,1680455756577,66190
13.6,,1680455945845,66190
14.1," Arshad Khan to Kohli, , What a hit!! In all fairness a slot ball on middle by Arshad Khan, Kohli clears his leg and gives it an almighty swing over deep mid-wicket. That was six on any ground, forget the smallest IPL ground... ",1680455954333,66190
14.1,Change of balls,1680455957333,66190
14.2," Arshad Khan to Kohli, 2 runs, Dropped!! This was the chance. It was a full delivery on the pads, flicked straight to Hritik Shokeen at deep mid-wicket. Pops in and out his hand... ",1680456017861,66190
14.3," Arshad Khan to Kohli, no run, short pitched and goes over the shoulder as Kohli tried a pull ",1680456051729,66190
14.4," Arshad Khan to Kohli, 1 run, low full toss, driven down the ground but David from long-on will cut it off ",1680456089338,66190
14.4," Arshad Khan to du Plessis,  Caught!! ",1680456126073,66190
14.5," Arshad Khan to du Plessis,  Caught by Tim David!! Finally a wicket!! This was the slower length ball, Faf is beaten by the lack of pace. Goes through his slog a bit too early and gets no timing. Goes high but lands in the hands of Tim David at long-on.   ",1680456129377,66190
14.5,,1680456228830,66190
14.6," Arshad Khan to Karthik, no run, full and straight, driven back to the bowler ",1680456235696,66190
14.6,,1680456235706,66190
14.6,The designated RCB finisher gets a promotion today. Eyeing net run rate already?,1680456238696,66190
14.6,,1680456301885,66190
15.1," Green to Kohli, 1 run, low full toss, Kohli shuffles in to clip towards deep backward square leg ",1680456306553,66190
15.1," Green to Kohli, 1 run, low full toss, Kohli shuffles in to clip towards deep backward square leg ",1680456306553,66190
15.1," Green to Kohli, 1 run, low full toss, Kohli shuffles in to clip towards deep backward square leg ",1680456306553,66190
15.2," Green to Karthik, no run, full on off, Karthik wanted to go over mid-off but timing eludes him. Falls tamely towards the fielder after a couple of bounces ",1680456376434,66190
15.2," Green to Karthik, no run, full on off, Karthik wanted to go over mid-off but timing eludes him. Falls tamely towards the fielder after a couple of bounces ",1680456376434,66190
15.2, Fact: MI Last won their opening match back in 2012.,1680456376435,66190
15.2, Fact: MI Last won their opening match back in 2012.,1680456376435,66190
15.2," Green to Karthik,  Caught!! ",1680456427316,66190
15.2," Green to Karthik,  Caught!! ",1680456427316,66190
15.3,"Green to Karthik,  Caught by Tilak Varma!! Oops, not to be for DK. This was pitched up on the pads, Karthik tries a flick but holes out straight to deep square leg. Tilak Varma completes a regulation catch. ",1680456429660,66190
15.3,"Green to Karthik,  Caught by Tilak Varma!! Oops, not to be for DK. This was pitched up on the pads, Karthik tries a flick but holes out straight to deep square leg. Tilak Varma completes a regulation catch. ",1680456429660,66190
15.3,,1680456483361,66190
15.3,,1680456483361,66190
15.4," Green to Maxwell, no run, short on the body, a very flimsy heave from Maxwell that goes nowhere. Lands tamely towards mid-on after pitching ",1680456538662,66190
15.4," Green to Maxwell, no run, short on the body, a very flimsy heave from Maxwell that goes nowhere. Lands tamely towards mid-on after pitching ",1680456538662,66190
15.5," Green to Maxwell, , That's one way to get off the mark!! Maxi isn't going to wait around here, this was short of length outside off, the Aussie all-rounder stays leg side and slaps it over deep extra cover. Complete backhand power on that one!! ",1680456574172,66190
15.5," Green to Maxwell, , That's one way to get off the mark!! Maxi isn't going to wait around here, this was short of length outside off, the Aussie all-rounder stays leg side and slaps it over deep extra cover. Complete backhand power on that one!! ",1680456574172,66190
15.5,,1680456574182,66190
15.5,,1680456574182,66190
15.6," Green to Maxwell, , Six more!! Green goes short on the body, Maxwell backs away and pulls over fine leg. Didn't come off the middle but who cares? Easily clears the man in the deep ",1680456618267,66190
15.6," Green to Maxwell, , Six more!! Green goes short on the body, Maxwell backs away and pulls over fine leg. Didn't come off the middle but who cares? Easily clears the man in the deep ",1680456618267,66190
16.1," Arshad Khan to Kohli, , length ball on the pads, Kohli with a late whip that beats the fine leg fielder in the circle and keeps running away from deep backward square leg ",1680456675544,66190
16.1," Arshad Khan to Kohli, , length ball on the pads, Kohli with a late whip that beats the fine leg fielder in the circle and keeps running away from deep backward square leg ",1680456675544,66190
16.2," Arshad Khan to Kohli, , short, too short and called wide ",1680456707760,66190
16.2," Arshad Khan to Kohli, , short, too short and called wide ",1680456707760,66190
16.2,One hit away now...,1680456710760,66190
16.2,One hit away now...,1680456710760,66190
16.2,"Arshad Khan to Kohli,  Infact, a shot similar to that iconic MSD one on the day India won the World Cup 12 years ago. This is much flatter though, but over long-on and into the stands...",1680456740144,66190
16.2,"Arshad Khan to Kohli,  Infact, a shot similar to that iconic MSD one on the day India won the World Cup 12 years ago. This is much flatter though, but over long-on and into the stands...",1680456740144,66190
post," IPL cricket is welcomed back at the M Chinnaswamy Stadium with a resounding win for the hosts. A superb overall performance, their bowlers got them wickets in the powerplay, and then the spinners kept things tight. And then the spotless chase. Faf du Plessis seems to be ageing like Benjamin Button, he is bringing all that SA20 form to the IPL and nobody is complaining. He couldn't quite stay till the end, but got RCB in such a strong position that they couldn't lose. And of course there was Virat Kohli. Hes a showman and he put on a show tonight at his adopted home ground. Kohli is back to playing with a smile on his face, picking up length early and some of those sixes just defined class. He stayed till the end although RCB lost a couple of wickets late on, to get the franchise home with almost four overs to spare...",1680456846116,66190
post," IPL cricket is welcomed back at the M Chinnaswamy Stadium with a resounding win for the hosts. A superb overall performance, their bowlers got them wickets in the powerplay, and then the spinners kept things tight. And then the spotless chase. Faf du Plessis seems to be ageing like Benjamin Button, he is bringing all that SA20 form to the IPL and nobody is complaining. He couldn't quite stay till the end, but got RCB in such a strong position that they couldn't lose. And of course there was Virat Kohli. Hes a showman and he put on a show tonight at his adopted home ground. Kohli is back to playing with a smile on his face, picking up length early and some of those sixes just defined class. He stayed till the end although RCB lost a couple of wickets late on, to get the franchise home with almost four overs to spare...",1680456846116,66190
post,"Some similar problems continue for Mumbai Indians. An underwhelming IPL return for Jofra Archer, and the rest of their bowlers also lacked any real bite. Their top-order too continues to falter. Ishan and Rohit had another bad day, Surya started but couldn't get going. The only positive is Tilak Varma, who actually played a blinder of an innings to get Mumbai a very competitive score after the first innings. A new season, but a sense of deja vu for Rohit and the boys. Let's hear what he has to say now...",1680456915809,66190
post,"Some similar problems continue for Mumbai Indians. An underwhelming IPL return for Jofra Archer, and the rest of their bowlers also lacked any real bite. Their top-order too continues to falter. Ishan and Rohit had another bad day, Surya started but couldn't get going. The only positive is Tilak Varma, who actually played a blinder of an innings to get Mumbai a very competitive score after the first innings. A new season, but a sense of deja vu for Rohit and the boys. Let's hear what he has to say now...",1680456915809,66190
post,,1680456915819,66190
post,,1680456915819,66190
post," Didn’t have a great start with the bat in the first six overs. But, it was a really good effort from Tilak and a few other batters. But, we didn’t execute well with the ball. It was a good pitch to bat on. (On Tilak Verma) He is a positive person, quite talented as well. Some of the shots he played, showed a lot of courage. Hats off to Tilak to get us to a competitive total. It was a good pitch to bat on. We didn’t set any target but we didn't even bat to half of our potential and we got to 170. Probably 30-40 runs more would have been ideal. From the last six to eight months I am used to playing without Jasprit Bumrah.  We can't keep dwelling on it. Injuries are not in our control, we can't do much about it. The other guys in the setup are quite talented as well. We need to give them that support. Just the first game of the season, there's a lot to look forward to.",1680457400191,66190
post," Didn’t have a great start with the bat in the first six overs. But, it was a really good effort from Tilak and a few other batters. But, we didn’t execute well with the ball. It was a good pitch to bat on. (On Tilak Verma) He is a positive person, quite talented as well. Some of the shots he played, showed a lot of courage. Hats off to Tilak to get us to a competitive total. It was a good pitch to bat on. We didn’t set any target but we didn't even bat to half of our potential and we got to 170. Probably 30-40 runs more would have been ideal. From the last six to eight months I am used to playing without Jasprit Bumrah.  We can't keep dwelling on it. Injuries are not in our control, we can't do much about it. The other guys in the setup are quite talented as well. We need to give them that support. Just the first game of the season, there's a lot to look forward to.",1680457400191,66190
post," I thought it was a phenomenal win, a homecoming after 4 years. Couldn't have asked for a better game. We bowled well for the first 17 overs but then credit to their batters especially Tilak who batted really well. It was a very comprehensive win and we wanted to win with balls to spare as it will benefit the NRR. The new ball was tricky, that's where we shifted the momentum, they can ride on that momentum from the last two overs of their batting but the way we started nullified all that momentum. We kept the pressure on the bowlers. Phenomenal, it was a packed crowd, every seat was full when we walked in here. Very important we started off well, their support propelled us and that makes a massive difference. I think he was phenomenal, phenomenal spell from him, that's brave bowling after getting the left-hander out [on Karn Sharma]. He was bowling so well for us last year but he couldn't play. Even in the nets he was not getting hit for sixes, hats off to him for coming and playing after so long, to perform  against such a strong MI side at the Chinnaswamy is great for him. I wanted to mention this for a while - after MI who have 5 titles and CSK who have 4, if I'm not wrong, we are the third team to have qualified the most times to the playoffs - 8 times. Take one game at a time and try to be a balanced side which we are and we would look to execute our plans as we did tonight.",1680457687223,66190
post," I thought it was a phenomenal win, a homecoming after 4 years. Couldn't have asked for a better game. We bowled well for the first 17 overs but then credit to their batters especially Tilak who batted really well. It was a very comprehensive win and we wanted to win with balls to spare as it will benefit the NRR. The new ball was tricky, that's where we shifted the momentum, they can ride on that momentum from the last two overs of their batting but the way we started nullified all that momentum. We kept the pressure on the bowlers. Phenomenal, it was a packed crowd, every seat was full when we walked in here. Very important we started off well, their support propelled us and that makes a massive difference. I think he was phenomenal, phenomenal spell from him, that's brave bowling after getting the left-hander out [on Karn Sharma]. He was bowling so well for us last year but he couldn't play. Even in the nets he was not getting hit for sixes, hats off to him for coming and playing after so long, to perform  against such a strong MI side at the Chinnaswamy is great for him. I wanted to mention this for a while - after MI who have 5 titles and CSK who have 4, if I'm not wrong, we are the third team to have qualified the most times to the playoffs - 8 times. Take one game at a time and try to be a balanced side which we are and we would look to execute our plans as we did tonight.",1680457687223,66190
post," Nice to start the way we did. In the powerplay, Siraj had the tail up and he set the tone. Right through the innings, our bowlers stuck to the plans. Obviously last 2-3 overs something to improve on. And that second innings, if you want to know how to chase a target, well, that's how you do it. If you took pace off the ball, it wasn't too easy to play and there was something in it for the spinners but as a batter if you got into good positions you could score runs. My first time playing here as a home player and it's a special player, especially batting with Virat Kohli. Energy bounces off him. You have to stay with the youngsters, I still work hard to be able to move around like I could in the young days. The confidence this gives, all of us are confidence players. This start will be huge for us as a team.",1680458139515,66190
post," Nice to start the way we did. In the powerplay, Siraj had the tail up and he set the tone. Right through the innings, our bowlers stuck to the plans. Obviously last 2-3 overs something to improve on. And that second innings, if you want to know how to chase a target, well, that's how you do it. If you took pace off the ball, it wasn't too easy to play and there was something in it for the spinners but as a batter if you got into good positions you could score runs. My first time playing here as a home player and it's a special player, especially batting with Virat Kohli. Energy bounces off him. You have to stay with the youngsters, I still work hard to be able to move around like I could in the young days. The confidence this gives, all of us are confidence players. This start will be huge for us as a team.",1680458139515,66190
post,"That's all for today. Two fairly one-sided games on this Sunday but that is the luck of the draw in the IPL. The good news is the big guns like Jos Buttler and Virat Kohli are firing from the get-go. Tomorrow, the IPL returns to Chepauk after way too long. That's going to be a wild ride in terms of the crowd. We'll bring in all your way, but for now this is  signing off on behalf ofB1$ and ",1680458382726,66190
post,"That's all for today. Two fairly one-sided games on this Sunday but that is the luck of the draw in the IPL. The good news is the big guns like Jos Buttler and Virat Kohli are firing from the get-go. Tomorrow, the IPL returns to Chepauk after way too long. That's going to be a wild ride in terms of the crowd. We'll bring in all your way, but for now this is  signing off on behalf ofB1$ and ",1680458382726,66190
