over_number,commentary_data,timestamp,match_id
18.1," Zampa to Abhinav Manohar, no run, quicker through the air on middle and leg, Abhinav Manohar mistimes his punch back to the bowler ",1681658840255,66274
18.2," Zampa to Abhinav Manohar, 1 run, pitched up by the bowler on off, Abhinav Manohar drives it along the carpet to long-off ",1681658865898,66274
18.3,"Zampa to Miller, , rocks back in the crease and hammers the pull towards deep mid-wicket for four runs",1681658908667,66274
18.4," Zampa to Miller, 1 run, fraction short on off, Miller drags it to long-on for a single ",1681658945155,66274
18.5," Zampa to Abhinav Manohar, , tossed up delivery by Zampa, right into the slot, Abhinav Manohar stands tall and launches it over long-on for an 89 metre six. High and handsome, almost out of the park! ",1681658979761,66274
18.5," Zampa to Abhinav Manohar,  Caught!! ",1681659021289,66274
18.5," Zampa to Abhinav Manohar,  Caught!! ",1681659021289,66274
18.6,"Zampa to Abhinav Manohar,  Caught by Padikkal!! Zampa has the last laugh! Goes full and wide outside off, Abhinav Manohar looks to go big against Zampa again and ends up slicing it towards point. No timing whatsoever and it's an easy catch for Padikkal. ",1681659024046,66274
18.6,,1681659090290,66274
18.6,,1681659135720,66274
19.1," Sandeep Sharma to Miller, , doesn't want to bowl this in Miller's arc, so he goes wide outside off, but misses the tramline too ",1681659153276,66274
19.1," Sandeep Sharma to Miller, no run, wide yorker outside off, but just inside the tramline this time around ",1681659194409,66274
19.2," Sandeep Sharma to Miller, , Sandeep Sharma goes full outside off, Miller goes deep inside the crease and spanks it over cover for four runs. Struck that really hard ",1681659233094,66274
19.3," Sandeep Sharma to Miller, , back-to-back boundaries. Full and wide outside off, Miller throws his hands at it, gets a thick outside edge that flies past short third man ",1681659284785,66274
19.3," Sandeep Sharma to Miller,  Caught!! ",1681659347039,66274
19.4," Sandeep Sharma to Miller,  Caught by Hetmyer!! End of Miller's pyrotechnics. A low full toss outside off, Miller throws the kitchen sink at it, miscues it towards deep cover and Hetmyer stationed near the fence takes it. Misses out on his fifty by a boundary.  ",1681659351074,66274
19.4,,1681659351084,66274
19.4,,1681659354074,66274
19.4,,1681659377996,66274
19.4," Sandeep Sharma to Rashid Khan,  Run Out!! ",1681659601973,66274
19.5," Sandeep Sharma to Rashid Khan,  Rashid Khan Run Out!! 1 run completed. Rashid has slapped this short ball towards long-on and he initially called for two. The fielder from the deep does well though as he fires in a flat throw at the bowler's end. Rashid tries to get back in, but the bowler whips off the bails in a flash. Rashid's bat was on the line, and he's run-out by a whisker.  ",1681659604223,66274
19.5,,1681659616131,66274
19.6," Sandeep Sharma to Rahul Tewatia, 1 run, a low full toss on off, Tewatia drives it towards mid-off and it's just a single to end the innings.  ",1681659643283,66274
19.6," Gujarat Titans end with a pretty challenging total, but Rajasthan Royals have a powerful batting line-up too. Talking about Gujarat's innings, they lost an early wicket in the form of Saha, but the Titans steadied the ship thereafter. Sudharsan was run-out by Buttler, but Pandya and Gill had a fine partnership following that. Gill missed out on his fifty as he was caught at long-off against Sandeep Sharma. Miller who was dropped by Zampa early in his innings went on to score 46 runs as well. Abhinav Manohar struck a few big sixes as well. Sandeep Sharma was the pick of the bowlers as he took a couple of wickets and conceded only 25 runs. Will RR manage to chase it down? Join us back in 10 minutes to find that out..",1681659646283,66274
19.6," There's a lot of dew, it was tough to hold and grip the ball towards the end as the ball was wet. Last time, I won the purple cap, I am focussing on the trophy this year. Zampa bowled well in the last game and he had a good match-up against Miller. Holder is unwell and hence we picked Zampa. It's difficult to bowl at the death (for spinners). It's isn't easy to score if the boundary size if big and if there's some turn. This a very good batting wicket and dew is also a plus point for us. Hopefully we will chase this.",1681659646294,66274
19.6,Welcome back for the run chase folks! The Gujarat players are out in the middle and so are the Rajasthan openers. Can Buttler and Jaiswal get the Royals off to another quick start? Let's find out..,1681659652283,66274
19.6,,1681660536320,66274
19.6,,1681660536320,66274
0.1," Shami to Jaiswal, , short ball outside off, way too wide though ",1681660539211,66274
0.1," Shami to Jaiswal, no run, on a length outside off, shapes away a touch, Jaiswal goes for a drive, gets beaten ",1681660564847,66274
0.2," Shami to Jaiswal, no run, 140.2kph, full and quick on middle and leg, driven to mid-on by Jaiswal ",1681660598549,66274
0.3," Shami to Jaiswal, no run, short and wide outside off, Jaiswal cuts it hard, but straight to point ",1681660633454,66274
0.4," Shami to Jaiswal, 1 run, banged in short by Shami, Jaiswal goes for a pull, gets hurried due to the pace and the top edge eludes the fielder at wide mid-on. Mohit Sharma is quick to gather the ball and get rid of it ",1681660677367,66274
0.5," Shami to Buttler, no run, 142.8 kph, this ball swings in sharply and strikes the batter on the pads. Shami appeals for an lbw, but goes no response from the umpire ",1681660729735,66274
0.6," Shami to Buttler, no run, short of a length around middle and leg, Buttler gets an inside edge towards the leg-side, as he tries to punch it on the rise. Shami concedes only 2 runs ",1681660760052,66274
0.6,,1681660830678,66274
1.1," Hardik Pandya to Jaiswal, no run, pitched up by Hardik Pandya outside off, shapes away, Jaiswal goes for a drive, gets beaten beaten ",1681660831875,66274
1.1, Probably two best bowling attacks of the season. Should be a tight game.,1681660831876,66274
1.2," Hardik Pandya to Jaiswal, no run, short of a length outside off, Jaiswal gets beaten on his cut ",1681660862434,66274
1.2," Hardik Pandya to Jaiswal,  Caught!! ",1681660898461,66274
1.3," Hardik Pandya to Jaiswal,  Caught by Shubman Gill!!  Short and quick outside off, some extra bounce on offer. This was angled across and Jaiswal has a poke at it. A regulation outside edge is induced and Gill at slip takes a comfortable catch. All-rounder Hardik in action tonight!  ",1681660899290,66274
1.3,,1681661000199,66274
1.4," Hardik Pandya to Padikkal, no run, outside off, Padikkal gets beaten on the first ball ",1681661009551,66274
1.4," Hardik Pandya to Padikkal, no run, outside off, Padikkal gets beaten on the first ball ",1681661009551,66274
1.5," Hardik Pandya to Padikkal, no run, full and wide outside off, Padikkal tries to flirt with it, makes no contact though ",1681661019292,66274
1.6," Hardik Pandya to Padikkal, 1 run, this one swings back in sharply and Padikkal gets an outside edge towards third man, takes a single ",1681661050998,66274
2.1," Shami to Padikkal, no run, short of a length outside off, curving away, Padikkal has a poke and almost nicks it behind ",1681661112593,66274
2.2," Shami to Padikkal, leg byes, 1 run, this one shapes back in, strikes the pads really high and lobs towards the off-side, a leg bye taken ",1681661184298,66274
2.3," Shami to Buttler, no run, swings hard, and gets hit on the thigh pad ",1681661185876,66274
2.4," Shami to Buttler, no run, rides the bounce, carves it towards the off-side does Buttler ",1681661229314,66274
2.4," Shami to Buttler,  Bowled!! ",1681661262613,66274
2.5," Shami to Buttler,  Bowled!!  This one swings in sharply and Buttler looks to scoop this towards the leg-side. Gets beaten comprehensively due to the movement and the off-stump has been rattled. Shami pumps the air as he is delighted. Royals in trouble having lost both their openers so early! Not a familiar territory for them.  ",1681661266338,66274
2.5,"STAT: Second duck for Buttler in the IPL. The first had come on his debut: vs RPS (Mumbai WS, 2016)",1681661266348,66274
2.5,,1681661380141,66274
2.6," Shami to Samson, no run, back of a length on middle and leg, nudged towards mid-on ",1681661382433,66274
3.1," Hardik Pandya to Padikkal, , drifting on the pads and Padikkal has flicked it uppishly over mid-wicket for the first boundary of the innings ",1681661437000,66274
3.2," Hardik Pandya to Padikkal, 1 run, short of a length outside off, Padikkal steers it away to square third man for a single ",1681661480628,66274
3.3," Hardik Pandya to Samson, no run, full and wide outside off, swinging away from the batter, Samson goes for a drive, gets beaten ",1681661537191,66274
3.4," Hardik Pandya to Samson, no run, on a length around off, Samson blocks it from within the crease ",1681661580432,66274
3.5," Hardik Pandya to Samson, no run, short ball outside off, some good carry, Samson leaves it alone ",1681661627241,66274
3.6," Hardik Pandya to Samson, , fantastic timing! Short of a length outside off, Samson times his cut through backward point as the ball races away to the fence at the rate of knots ",1681661679849,66274
4.1," Shami to Padikkal, no run, short of a length outside off, shaping away from the batter, Padikkal has a poke and gets beaten ",1681661735017,66274
4.2," Shami to Padikkal, no run, short and quick on off, Padikkal rides the bounce and taps it to point ",1681661770519,66274
4.2," Shami to Padikkal, no run, short and quick on off, Padikkal rides the bounce and taps it to point ",1681661770519,66274
4.3," Shami to Padikkal, no run, the ball is making the batters dance. Shami is making them dance to their tunes. Padikkal makes room to play this one, but Shami hits the deck and the ball curves back in sharply, Padikkal swings and misses ",1681661804032,66274
4.4," Shami to Padikkal, no run, and this one goes the other way round. Curves away from the batter from a shorter length and Padikkal gets beaten on his flashy cut ",1681661846451,66274
4.5," Shami to Padikkal, ,  Shami errs in line, drifts on the batter's pads and Padikkal has flicked it away with ease over deep backward square leg ",1681661891110,66274
4.5, Good to see Hardik hurrying his team to take their fielding positions between the overs and fall of wickets.,1681661891111,66274
4.6," Shami to Padikkal, 1 run,  Slashes away from his body outside off, and gets a thick outside edge. Flies quickly to Gill who gets his hands to it, but fails to latch on to it. Think Gill has injured himself while attempting that catch, he has walked off the field with the physio ",1681661943926,66274
5.1," Hardik Pandya to Padikkal, no run, back of a length around off, Padikkal defends ",1681662025840,66274
5.2," Hardik Pandya to Padikkal, no run, Hardik Pandya goes short and Padikkal mistimes his pull towards mid-on ",1681662067273,66274
5.3," Hardik Pandya to Padikkal, no run, cramped for room on this occasion, Padikkal nudges it to mid-on ",1681662109942,66274
5.4," Hardik Pandya to Padikkal, , on a length outside off, Padikkal latches on to it and launches it over wide long-off for a clean six. No respect shown to the opposition skipper whatsoever ",1681662157367,66274
5.5," Hardik Pandya to Padikkal, no run, short of a length around off, Padikkal stays put and defends ",1681662214624,66274
5.6," Hardik Pandya to Padikkal, no run,  ends his over with a bouncer and Padikkal sways away ",1681662273537,66274
5.6," This is the bowling of highest quality, very rare that we are witnessing this in T20 cricket.. INCREDIBLE SWING BOWLING....",1681662273538,66274
5.6,,1681662273547,66274
5.6,,1681662273557,66274
5.6,,1681662273567,66274
5.6,,1681662346454,66274
5.6, Suddenly the pitch of Ahmedabad  became pitch of Lord's while Shami was bowling,1681662346455,66274
6.1," Alzarri Joseph to Samson, no run, , short of a length outside off, sharp carry as Samson gets beaten on his cut ",1681662394092,66274
6.2," Alzarri Joseph to Samson, ,  Short and quick at the hips, Samson stands tall and swipes it over deep square leg for a well-timed six. No fast bowler likes that. The comeback better be a good one ",1681662433360,66274
6.3," Alzarri Joseph to Samson, no run,  hits the deck on a length as Samson knocks it firmly to mid-on ",1681662487229,66274
6.4," Alzarri Joseph to Samson, 1 run, short of a length on middle and leg, pats this to mid-on and scampers across to the other end ",1681662527554,66274
6.5," Alzarri Joseph to Padikkal, , on a length outside off, Padikkal stays put and lofts this over the infield at cover. This one almost goes the distance ",1681662573619,66274
6.5," Alzarri Joseph to Padikkal, , on a length outside off, Padikkal stays put and lofts this over the infield at cover. This one almost goes the distance ",1681662573619,66274
6.6," Alzarri Joseph to Padikkal, 1 run, shorter ball outside off, slapped through cover-point by Padikkal ",1681662613959,66274
7.1," Hardik Pandya to Padikkal, 1 run, good length onto the pads, turned towards deep square leg. ",1681662682139,66274
7.1,Hardik was looking a bit jaded by the end of last over but he is bowling out here. Could be a big over!,1681662685139,66274
7.2," Hardik Pandya to Samson, 1 run, good length angling onto leg, clipped towards deep mid-wicket ",1681662727558,66274
7.3," Hardik Pandya to Padikkal, 1 run, back of length onto middle, pulled along the ground towards deep backward square leg ",1681662770885,66274
7.3,"ICYMI, GT have still not chosen their impact player. They could also go for an overseas player because they started with just three",1681662773885,66274
7.3,"Review taken for LBW by Gujarat. No bat for sure. Hits Samson on the knee roll but the angle could have taken the ball down leg. Yes, too much movement and goes down leg",1681662776885,66274
7.4," Hardik Pandya to Samson, no run, GT burn a review!! This was pitched fuller and angles in sharply to get Samson on the knee roll. But the ball was doing too much and going down leg ",1681662893799,66274
7.5," Hardik Pandya to Samson, , What a shot!! That's some reply from Sanju Samson. On a length and slightly wider, Samson with a checked drive between extra cover and mid-off. Races away for four... ",1681662922839,66274
7.6," Hardik Pandya to Samson, 1 run, good length onto leg, turned towards deep mid-wicket ",1681662971674,66274
7.6," Two contrasting tactics on show today as RR went with three frontline spinners while GT are yet to even introduce spin. At the moment, it looks like Hardik Pandya got a better reading of the pitch, because it has been swinging like it is an overcast day in England. Rajasthan have absorbed the powerplay pressure, and Samson has looked really mature so far in his innings. Crucial few overs coming up...",1681662974674,66274
7.6,,1681663148293,66274
8.1," Rashid Khan to Samson, 1 run, short outside off, no turn. Slapped towards the sweeper ",1681663165362,66274
8.2," Rashid Khan to Padikkal, no run, pushed quicker onto leg. Padikkal defends to the left of Rashid and he's quick to get to the ball ",1681663192454,66274
8.2," Rashid Khan to Padikkal,  Caught!! ",1681663241850,66274
8.3," Rashid Khan to Padikkal,  Caught by Mohit Sharma!! Wicket straight away for Rashid. Padikkal decided this was the over to target, and charged out to the spinner's googly to play a big heave. Gets a leading edge and Mohit Sharma at short third makes no mistake.  ",1681663244976,66274
8.3,,1681663291012,66274
8.4," Rashid Khan to Riyan Parag, 1 run, fuller on the pads, turned towards deep mid-wicket ",1681663300847,66274
8.5," Rashid Khan to Samson, 1 run, onto the pads again, Samson clips towards deep mid-wicket ",1681663326316,66274
8.5," Rashid Khan to Samson, 1 run, onto the pads again, Samson clips towards deep mid-wicket ",1681663326316,66274
8.6," Rashid Khan to Riyan Parag, 1 run, shorter length turning into leg, punched towards deep mid-wicket off the backfoot ",1681663347409,66274
8.6,Big innings also for Riyan Parag. Can this be the match where he repays the faith RR have been having in him all these years?,1681663350409,66274
8.6,,1681663414172,66274
9.1," Mohit Sharma to Riyan Parag, no run, good length outside off and zips through. Parag goes for a cut but the ball goes over his bat ",1681663417424,66274
9.2," Mohit Sharma to Riyan Parag, 1 run, on a length closer to off, punched to the left of Pandya at covers for a single ",1681663461216,66274
9.3," Mohit Sharma to Samson, no run, good length and straight line, punched towards mid-off ",1681663498458,66274
9.4," Mohit Sharma to Samson, no run, nice tight line on off from Mohit Sharma. Samson can only push towards mid-off ",1681663538363,66274
9.4, A Sanju special is long due.,1681663538364,66274
9.4,,1681663538373,66274
9.5," Mohit Sharma to Samson, 1 run, good length wicket to wicket bowling, Samson backed away to punch towards the sweeper ",1681663593032,66274
9.6," Mohit Sharma to Riyan Parag, 1 run, length ball onto the pads, turned towards deep mid-wicket.  ",1681663631692,66274
10.1," Rashid Khan to Riyan Parag, 1 run, goggly from a length, Parag shimmies inwards to turn towards deep backward square leg ",1681663703222,66274
10.2," Rashid Khan to Samson, 1 run, another googly, Samson goes onto the backfoot and waits for the turn, then pushes towards mid-on ",1681663731914,66274
10.2," Rashid Khan to Riyan Parag,  Caught!! ",1681663763977,66274
10.3," Rashid Khan to Riyan Parag,  Caught by Miller!! Gone!! Riyan Parag had to go for the big shot, this was a quick leg spinner leaving the batter. Parag went for a flashy drive down the ground - goes hard and flat towards long-off and Miller takes a nice catch as the ball was dying on him.  ",1681663767836,66274
10.3,,1681663850123,66274
10.4," Rashid Khan to Hetmyer, no run, googly from middle stump, Hetmyer defends to the leg side ",1681663876906,66274
10.5," Rashid Khan to Hetmyer, 1 run, flat delivery on middle, punched towards long-off ",1681663902231,66274
10.6," Rashid Khan to Samson, , OUT OF HERE!! Fraction short and turning into the pads, Samson goes back and hoists his pull deep into the stands beyond deep mid-wicket. He really needed one big shot to get going... ",1681663939295,66274
10.6," One more day, one more disappointment. Riyan Parag disaster continues. I don't understand when will RR move on...",1681663939296,66274
11.1," Mohit Sharma to Hetmyer, no run, full and straight, blocked towards mid-off ",1681664025278,66274
11.1," Mohit Sharma to Hetmyer, no run, full and straight, blocked towards mid-off ",1681664025278,66274
11.2," Mohit Sharma to Hetmyer, no run, full and angling onto off, Hetmyer leans in to drive but towards extra cover ",1681664064439,66274
11.3," Mohit Sharma to Hetmyer, 1 run, length ball onto middle, Hetmyer got into a very awkward position and aimlessly skies his pull. Very lucky it lands in no man's land near mid-wicket with everyone on the boundary ropes... ",1681664111088,66274
11.4," Mohit Sharma to Samson, 1 run, good length on off, driven square of the wicket - just a single ",1681664163619,66274
11.5," Mohit Sharma to Hetmyer, 1 run, fraction short onto middle and rushes the batter who turns it towards deep mid-wicket ",1681664200439,66274
11.6," Mohit Sharma to Samson, 1 run, pushed a bit fuller and wider as Samson gave Mohit the charge. Driven past the bowler but long-off will cut it off.  ",1681664249847,66274
11.6,GT get their Impact Player on.  comes on for his first IPL appearance. He replaces Gill,1681664252847,66274
12.1," Rashid Khan to Samson, no run, flat delivery on off, defended into the pitch ",1681664390679,66274
12.2," Rashid Khan to Samson, , flat on off, Samson goes for the big shot and slaps it down the ground. Miller was hugging the ropes at long-off and jumps as high as possible, but the ball goes over... ",1681664395481,66274
12.3," Rashid Khan to Samson, , short, Samson rocks back and pulls it hard. Didn't get it off the middle but enough muscle behind it to clear the fielder at cow corner... ",1681664406813,66274
12.4,"Rashid Khan to Samson, , hat-trick of sixes!! This was flat and too short, Samson rocks back and this time the pull is more convincing. In front of square and over wide long-on into the stands...",1681664447844,66274
12.5," Rashid Khan to Samson, 1 run, zipped fuller on off, Samson drives towards deep point ",1681664488867,66274
12.6," Rashid Khan to Hetmyer, 1 run, full on the pads, turned to mid-on for a single.  ",1681664524661,66274
12.6,,1681664603375,66274
13.1," Alzarri Joseph to Hetmyer, , once again the ball goes just over a jumping fielder. This was a slot ball on middle by Joseph. Hetmyer clears his leg for a heave through square leg - not off the middle but over Manohar's head for six ",1681664611181,66274
13.2," Alzarri Joseph to Hetmyer, 1 run, better, almost the perfect yorker. Dug out towards deep mid-wicket ",1681664641272,66274
13.3," Alzarri Joseph to Samson, 1 run, length ball onto middle, Samson drives hard but towards long-on ",1681664684544,66274
13.4," Alzarri Joseph to Hetmyer, , attempted yorker but ends as a low full toss. Hetmyer slogs it between deep mid-wicket and deep square. One bounce and four... ",1681664731018,66274
13.5," Alzarri Joseph to Hetmyer, 2 runs, short pitched delivery, pulled to the right of deep mid-wicket for a couple of runs ",1681664772716,66274
13.6," Alzarri Joseph to Hetmyer, 1 run, nice yorker again. Stabbed out towards mid-off for a quick single ",1681664814874,66274
13.6," Alzarri Joseph to Hetmyer, 1 run, nice yorker again. Stabbed out towards mid-off for a quick single ",1681664814874,66274
13.6,,1681664814884,66274
13.6,"Here's the impact player - Noor Ahmad. He is pretty much an unknown commodity in the IPL, let's hope the RR analysts had enough videos to study him. Could be a big over",1681664817874,66274
13.6,,1681664875968,66274
14.1," Noor Ahmad to Hetmyer, 1 run, flat delivery that comes in to the left-hander. Hetmyer punches towards long-on off the backfoot ",1681664918840,66274
14.2," Noor Ahmad to Samson, 1 run, flighted up just outside off, Samson pushes it to the right of Pandya at extra cover for a single. ",1681664956942,66274
14.3," Noor Ahmad to Hetmyer, 1 run, flighted up and turns in, Hetmyer gets a thick inside edge on the drive towards deep mid-wicket ",1681664996998,66274
14.4," Noor Ahmad to Samson, , SIX MORE!! This was tossed up outside off, spinning away. Samson slices his big drive slightly but still manages to get enough bat on it to go past long-off ",1681665032374,66274
14.5," Noor Ahmad to Samson, , Noor Ahmad misses his line, strays down leg and Samson flicks it to the right of short fine for a boundary ",1681665069638,66274
14.5," Noor Ahmad to Samson,  Caught!! ",1681665116965,66274
14.6," Noor Ahmad to Samson,  Caught by Miller!! Big moment, Samson was the only one looking like taking the game away. A rush of blood for him as he couldn't resist himself seeing the ball in his arc on off. Toe-ends his big drive and Miller from long-off runs in, keeps his eyes on the ball throughout and completes the catch. IB1$  ",1681665121431,66274
14.6," Impact players is a great addition to IPL, gives more options to the teams",1681665121541,66274
14.6,,1681665194501,66274
15.1," Alzarri Joseph to Hetmyer, 2 runs, slot ball on middle again, Hetmyer heaves it down the ground and just short and to the left of Miller at long-off. Does really well infact to get both hands behind the ball and stop the boundary ",1681665239273,66274
15.2,"Alzarri Joseph to Hetmyer, , Oh dear. This one slips out Joseph's hand. A waist high full toss and Hetmyer was just getting his bat down to protect himself. The ball takes a leading edge at flies over third-man for a six. Given no ball by the umpire but challenged by Pandya, replays show Hetmyer was out his crease and the ball would have just ended below waist. Strangely, Shami was standing well in front of the boundary rope. He didn't even jump and the ball just cleared the ropes...",1681665376794,66274
15.3," Alzarri Joseph to Hetmyer, 1 run, good length onto leg, Hetmyer was backing away and can only tap it leg side for a single ",1681665413074,66274
15.4," Alzarri Joseph to Dhruv Jurel, , lovely!! A touch of class from the youngster playing his first ball. good length ball that shoots onto off, Jurel shuffles in and gives it a late dab to run it down between keeper and short third. ",1681665460193,66274
15.5," Alzarri Joseph to Dhruv Jurel, 1 run, short pitched, Jurel pulls a tad uppishly but on the bounce towards deep square ",1681665503347,66274
15.6," Alzarri Joseph to Hetmyer, , smoked!! The sound was so sweet that we knew it was six straight away. Attempted yorker from Joseph which lands short of his mark. Hetmyer gets under and hammers his drive over long-on into the stands. ",1681665555644,66274
15.6," We all need a breather now, don't we? What a fightback this has been from RR. Samson with a fifty of the highest quality, but then falls to the impact player. Hetmyer is still there and seeing them nicely, and Jurel has looked positive too in the couple of balls he has faced. One big over either side decides the game from here... you wouldn't want to miss this finish!!",1681665558644,66274
16.1," Noor Ahmad to Dhruv Jurel, , flighted up but very wide outside off. Jurel goes chasing and drives it square. Looked like just a couple as Rashid ran in from sweeper and dived onto the ball. He stopped the ball but it deflects off his body into the fence... ",1681665760654,66274
16.1," Noor Ahmad to Dhruv Jurel, , flighted up but very wide outside off. Jurel goes chasing and drives it square. Looked like just a couple as Rashid ran in from sweeper and dived onto the ball. He stopped the ball but it deflects off his body into the fence... ",1681665760654,66274
