over_number,commentary_data,timestamp,match_id
16.2," Noor Ahmad to Dhruv Jurel, no run, full on leg, Jurel tries to sweep but can't connect ",1681665790090,66274
16.3," Noor Ahmad to Dhruv Jurel, no run, short and spinning away outside off. Jurel tries to cut but can't connect again. Two dots!! ",1681665817286,66274
16.3,"Appeal for run-out. If this is out, Hetmyer will be the man gone. Agonizing watching the slow motion replay... but Hetmyer gets there!!",1681665820286,66274
16.4,"Noor Ahmad to Dhruv Jurel, 1 run, flat delivery that turned away from leg. Deflects off the thigh pad towards short fine for a single.",1681665897019,66274
16.5," Noor Ahmad to Hetmyer, , full and spinning away from the batter at pace. Too wide and the umpire calls it ",1681665918565,66274
16.5," Noor Ahmad to Hetmyer, 1 run, flat and this one spun in. Clipped towards deep square for a single ",1681665941270,66274
16.6," Noor Ahmad to Dhruv Jurel, 1 run, flighted up, driven a tad uppishly towards Miller at long-off. Just a single ",1681665973400,66274
16.6,,1681666044846,66274
17.1," Rashid Khan to Dhruv Jurel, 1 run, half tracker that was spinning in. Jurel stepped out early and had to adjust to pull it behind square. Just a single ",1681666048206,66274
17.2," Rashid Khan to Hetmyer, no run, googly going just outside off, Hetmyer punches off the backfoot but straight towards Pandya at covers ",1681666074093,66274
17.3," Rashid Khan to Hetmyer, , bad ball, straying onto leg and Hetmyer pulls it to the right of short fine for a boundary!! ",1681666095017,66274
17.4," Rashid Khan to Hetmyer, no run, googly that spun in from outside leg to get Hetmyer on the back thigh pad. He was through the shot early ",1681666122528,66274
17.5," Rashid Khan to Hetmyer, , what a cat and mouse game here!! Rashid gives it some flight, Hetmyer steps out to the pitch - gets under it and slams over long-on. What a valuable six... ",1681666143053,66274
17.6," Rashid Khan to Hetmyer, 2 runs, googly going outside off, punched to the left of deep extra for a couple of runs.  ",1681666175127,66274
17.6,,1681666249337,66274
18.1,"Shami to Dhruv Jurel, , Dhruv Jurel, take a bow!! Shami has figures of 1/9 so far and he was scary with that swing. But first ball in the death is a half volley onto leg, still had to be put away and Jurel whacks it over long-on.",1681666254260,66274
18.1," Shami to Dhruv Jurel,  Caught!! ",1681666296848,66274
18.2,"Shami to Dhruv Jurel,  Caught by Mohit Sharma!! What a riveting match this has been!! Shami goes bouncer this time, Jurel isn't afraid to play the hook but this time top-edges and Mohit Sharma from fine leg runs in to complete the catch. So many twists in this game, Abbas Mustan couldn't have written such a script...",1681666300256,66274
18.2,,1681666347430,66274
18.2,,1681666347430,66274
18.2,,1681666347430,66274
18.3," Shami to Ashwin, , another twist!! Back of length outside off, Ashwin stays deep in his crease and cuts it behind square on the off side. Four more... ",1681666388754,66274
18.3," Shami to Ashwin, , another twist!! Back of length outside off, Ashwin stays deep in his crease and cuts it behind square on the off side. Four more... ",1681666388754,66274
18.4," Shami to Ashwin, , wow! Short pitched and Ashwin was ready. Very deep in his crease and pulled over deep mid-wicket. Just over the boundary ropes, but they still count as six... ",1681666427041,66274
18.4," Shami to Ashwin, , wow! Short pitched and Ashwin was ready. Very deep in his crease and pulled over deep mid-wicket. Just over the boundary ropes, but they still count as six... ",1681666427041,66274
18.4," Shami to Ashwin,  Caught!! ",1681666483699,66274
18.4," Shami to Ashwin,  Caught!! ",1681666483699,66274
18.5," Shami to Ashwin,  Caught by Rahul Tewatia!! Jesus, how many more twists are we going to get. This was actually the worst ball of the over. It was full outside off, there to be hit but Ashwin slices his drive down the throat of Tewatia at backward point. Madness!!  ",1681666487246,66274
18.5," Shami to Ashwin,  Caught by Rahul Tewatia!! Jesus, how many more twists are we going to get. This was actually the worst ball of the over. It was full outside off, there to be hit but Ashwin slices his drive down the throat of Tewatia at backward point. Madness!!  ",1681666487246,66274
18.5,,1681666522784,66274
18.5,,1681666522784,66274
18.6," Shami to Boult, no run, yorker that goes between stumps and a backing away Boult. Swing and a miss... ",1681666558064,66274
18.6," Shami to Boult, no run, yorker that goes between stumps and a backing away Boult. Swing and a miss... ",1681666558064,66274
18.6,"This Shami over deserves a web series in itself, every ball had so much drama!!",1681666561064,66274
18.6,"This Shami over deserves a web series in itself, every ball had so much drama!!",1681666561064,66274
18.6,Noor Ahmad for the last over. What a big gamble by Pandya.,1681666564064,66274
18.6,Noor Ahmad for the last over. What a big gamble by Pandya.,1681666564064,66274
18.6,,1681666633162,66274
18.6,,1681666633162,66274
19.1," Noor Ahmad to Hetmyer, 2 runs, short and wide, cut square of the wicket. Slightly to the right of Rashid and his throw is too wide. Allows Hetmyer to come back.  ",1681666651016,66274
19.1," Noor Ahmad to Hetmyer, 2 runs, short and wide, cut square of the wicket. Slightly to the right of Rashid and his throw is too wide. Allows Hetmyer to come back.  ",1681666651016,66274
19.2," Noor Ahmad to Hetmyer, , He's done it!! Take a bow Shimron Hetmyer, punches the air and yelps in delight. Too short by Noor Ahmad, allows Hetmyer to go back and slam his pull over cow corner. A flat six, over a region where there was no deep fielder... What a sensational chase by Rajasthan!! ",1681666693050,66274
19.2," Noor Ahmad to Hetmyer, , He's done it!! Take a bow Shimron Hetmyer, punches the air and yelps in delight. Too short by Noor Ahmad, allows Hetmyer to go back and slam his pull over cow corner. A flat six, over a region where there was no deep fielder... What a sensational chase by Rajasthan!! ",1681666693050,66274
post," These two teams are ranked first and third on the points table, and they were the finalists last season. Today's game shows us exactly why. One of those games where you have to write the cliche 'cricket is the real winner.' Stunning game at Ahmedabad, it was a boxing contest between two heavyweights - punch and counter punch and ultimately Hetmyer delivered the knockout blow. This chase started with a sensational display of swing bowling, as temporarily we were transported to Lord's on an overcast morning thanks to Pandya and Shami. They picked up Jaiswal and Buttler for a cumulative score of one run.",1681666766706,66274
post," These two teams are ranked first and third on the points table, and they were the finalists last season. Today's game shows us exactly why. One of those games where you have to write the cliche 'cricket is the real winner.' Stunning game at Ahmedabad, it was a boxing contest between two heavyweights - punch and counter punch and ultimately Hetmyer delivered the knockout blow. This chase started with a sensational display of swing bowling, as temporarily we were transported to Lord's on an overcast morning thanks to Pandya and Shami. They picked up Jaiswal and Buttler for a cumulative score of one run.",1681666766706,66274
post,"RR counter-attacked with Padikkal who struck a few sixes in the powerplay, but he fell to Rashid shortly after the time-out. Riyan Parag had another forgettable day with the bat, but skipper Sanju Samson stood tall. He took on the main wicket-taker Rashid and came out smiling, as he smashed three consecutive sixes off him. Shimron Hetmyer at the other end augmented his reputation as a finisher by taking on Alzarri Joseph. GT threw a curve ball in the form of mystery spinner Noor Ahmad, and the impact sub got the wicket of Samson. But RR were relentless in their fight, as Dhruv Jurel and Hetmyer never let the momentum drop. Then came Shami's final over, where literally every ball told a story in itself. Ultimately, the equation was down to 7 off the last over and Hetmyer smoked one over cow corner to ensure RR finally get the better of Gujarat. Why Mohit Sharma bowled just two overs after conceding just seven runs will remain a mystery...",1681666766716,66274
post,"RR counter-attacked with Padikkal who struck a few sixes in the powerplay, but he fell to Rashid shortly after the time-out. Riyan Parag had another forgettable day with the bat, but skipper Sanju Samson stood tall. He took on the main wicket-taker Rashid and came out smiling, as he smashed three consecutive sixes off him. Shimron Hetmyer at the other end augmented his reputation as a finisher by taking on Alzarri Joseph. GT threw a curve ball in the form of mystery spinner Noor Ahmad, and the impact sub got the wicket of Samson. But RR were relentless in their fight, as Dhruv Jurel and Hetmyer never let the momentum drop. Then came Shami's final over, where literally every ball told a story in itself. Ultimately, the equation was down to 7 off the last over and Hetmyer smoked one over cow corner to ensure RR finally get the better of Gujarat. Why Mohit Sharma bowled just two overs after conceding just seven runs will remain a mystery...",1681666766716,66274
post," To be honest no (didn't expect the loss after the powerplay), but that's the beauty about this game. The game is never over till it's over, another lesson for us. (Noor Ahmad) He's someone who's difficult to pick, got us the big breakthrough but the other bowlers didn't execute. Body is good, everything is good. It's a very long tournament. A lot of matches left, we still need to play a lot of group cricket even if we had won today. (On Gujarat's score) I felt short. After I got out, they bowled a couple of good overs, but we should have gone a little harder and got to 200. We did cover it well but when I was watching from outside, I did feel that we were 10 runs maybe short.",1681666766726,66274
post," To be honest no (didn't expect the loss after the powerplay), but that's the beauty about this game. The game is never over till it's over, another lesson for us. (Noor Ahmad) He's someone who's difficult to pick, got us the big breakthrough but the other bowlers didn't execute. Body is good, everything is good. It's a very long tournament. A lot of matches left, we still need to play a lot of group cricket even if we had won today. (On Gujarat's score) I felt short. After I got out, they bowled a couple of good overs, but we should have gone a little harder and got to 200. We did cover it well but when I was watching from outside, I did feel that we were 10 runs maybe short.",1681666766726,66274
post," It got a little tensed in the end, especially when the match went down to the wire, but we had the batter out there who could finish it off. We had to keep the scoreboard ticking, and we made sure to get that odd-boundary. It was moving around a but in the first few overs, but thankfully we got through those overs. It's unbelievable how he (Hetmyer) does such things, such a great talent to have in our side.",1681666766736,66274
post," It got a little tensed in the end, especially when the match went down to the wire, but we had the batter out there who could finish it off. We had to keep the scoreboard ticking, and we made sure to get that odd-boundary. It was moving around a but in the first few overs, but thankfully we got through those overs. It's unbelievable how he (Hetmyer) does such things, such a great talent to have in our side.",1681666766736,66274
post,,1681666766746,66274
post,,1681666766746,66274
post," When you play quality opponents on a quality wicket, you get such games. Very happy to compete in such a game and come out on top. It was important to rotate our bowlers, they were playing some quality cricket and we had to respect that. The whole team came up well today and we could restrict them to around 170. The start we had, it shows how good a wicket this was. The new ball the quality of swing bowling was good and we had to respect that. But today Zampa coming was a way to match-up with the opponents. He was the match-up for Miller and almost got the wicket, but the catch was dropped. (On Hetmyer) He doesn't like easy situations, we like putting him in such situations because he usually wins us games from such situations.",1681667543901,66274
post," When you play quality opponents on a quality wicket, you get such games. Very happy to compete in such a game and come out on top. It was important to rotate our bowlers, they were playing some quality cricket and we had to respect that. The whole team came up well today and we could restrict them to around 170. The start we had, it shows how good a wicket this was. The new ball the quality of swing bowling was good and we had to respect that. But today Zampa coming was a way to match-up with the opponents. He was the match-up for Miller and almost got the wicket, but the catch was dropped. (On Hetmyer) He doesn't like easy situations, we like putting him in such situations because he usually wins us games from such situations.",1681667543901,66274
post,"I don't have any words. Difficult to win against these guys, they beat us thrice last year but today was sort of a revenge. I practise these situations, it helps when you practise with that mindset of knowing we are few wickets down and chasing 100 with 8 overs to go. (On Noor Ahmad bowling the final over) I was actually pretty happy to be honest, he bowled well throughout so the first ball all I was thinking about was getting that double and take it from there.",1681668114940,66274
post,"I don't have any words. Difficult to win against these guys, they beat us thrice last year but today was sort of a revenge. I practise these situations, it helps when you practise with that mindset of knowing we are few wickets down and chasing 100 with 8 overs to go. (On Noor Ahmad bowling the final over) I was actually pretty happy to be honest, he bowled well throughout so the first ball all I was thinking about was getting that double and take it from there.",1681668114940,66274
post,"The final of 2022 was a pretty drub affair, but this game today more than compensates for it. Cricket of the highest quality played between two opponents who matched each other stride for stride. Ultimately, Rajasthan got over the line... It was a pleasure covering this game for y'all. May the IPL long produce such thrillers. On that thought, this is  signing off on behalf on and ",1681668313992,66274
post,"The final of 2022 was a pretty drub affair, but this game today more than compensates for it. Cricket of the highest quality played between two opponents who matched each other stride for stride. Ultimately, Rajasthan got over the line... It was a pleasure covering this game for y'all. May the IPL long produce such thrillers. On that thought, this is  signing off on behalf on and ",1681668313992,66274
